Cluster Subject 1,Cluster Subject 2,Cluster Subject 3,Cluster Subject 4,KIRINYAGA UNIVERSITY,MAT A,PHY,degree
BACHELOR OF SCIENCE (MOLECULAR & CELLULAR BIOLOGY),"{'Cluster Subject 1': 'MAT A', 'Cluster Subject 2': 'BIO', 'Cluster Subject 3': 'BIO', 'Cluster Subject 4': 'BIO'}","{'Subject 1': {'MAT A': 'C'}, 'Subject 2': {'BIO': 'C+'}, 'Subject 3': {'CHE': 'C'}}","{'KISII UNIVERSITY': 'BACHELOR OF SCIENCE (CELLULAR AND MOLECULAR BIOLOGY)', 'KENYATTA UNIVERSITY': 'BACHELOR OF SCIENCE (MOLECULAR & CELLULAR BIOLOGY)'}"
BACHELOR OF SCIENCE IN MOLECULAR BIOLOGY AND FORENSIC TECHNOLOGY,"{'Cluster Subject 1': 'MAT A', 'Cluster Subject 2': 'BIO', 'Cluster Subject 3': 'BIO', 'Cluster Subject 4': 'BIO'}","{'Subject 1': {'MAT A': 'C'}, 'Subject 2': {'BIO': 'C+'}, 'Subject 3': {'CHE': 'C'}}",{'TECHNICAL UNIVERSITY OF MOMBASA': 'BACHELOR OF SCIENCE IN MOLECULAR BIOLOGY AND FORENSIC TECHNOLOGY'}
BACHELOR OF SCIENCE (BOTANY),"{'Cluster Subject 1': 'MAT A', 'Cluster Subject 2': 'BIO', 'Cluster Subject 3': 'BIO', 'Cluster Subject 4': 'BIO'}","{'Subject 1': {'MAT A': 'C'}, 'Subject 2': {'BIO': 'C+'}, 'Subject 3': {'CHE': 'C'}}","{'MASENO UNIVERSITY': 'BACHELOR OF SCIENCE (BOTANY, WITH IT)', 'MERU UNIVERSITY OF SCIENCE AND TECHNOLOGY': 'BACHELOR OF SCIENCE (BOTANY)', 'RONGO UNIVERSITY': 'BACHELOR OF SCIENCE (BOTANY)'}"
"BACHELOR OF SCIENCE (BOTANY, WITH IT)","{'Cluster Subject 1': 'MAT A', 'Cluster Subject 2': 'BIO', 'Cluster Subject 3': 'BIO', 'Cluster Subject 4': 'BIO'}","{'Subject 1': {'MAT A': 'C'}, 'Subject 2': {'BIO': 'C+'}, 'Subject 3': {'CHE': 'C'}}","{'MASENO UNIVERSITY': 'BACHELOR OF SCIENCE (BOTANY, WITH IT)', 'MERU UNIVERSITY OF SCIENCE AND TECHNOLOGY': 'BACHELOR OF SCIENCE (BOTANY)', 'RONGO UNIVERSITY': 'BACHELOR OF SCIENCE (BOTANY)'}"
BACHELOR OF SCIENCE IN ZOOLOGY (GENOMIC SCIENCE),"{'Cluster Subject 1': 'MAT A', 'Cluster Subject 2': 'BIO', 'Cluster Subject 3': 'BIO', 'Cluster Subject 4': 'BIO'}","{'Subject 1': {'MAT A': 'C'}, 'Subject 2': {'BIO': 'C+'}, 'Subject 3': {'CHE': 'C'}}","{'JOMO KENYATTA UNIVERSITY OF AGRICULTURE AND TECHNOLOGY': 'BACHELOR OF SCIENCE (ZOOLOGY)', 'MERU UNIVERSITY OF SCIENCE AND TECHNOLOGY': 'BACHELOR OF SCIENCE (ZOOLOGY)', 'RONGO UNIVERSITY': 'BACHELOR OF SCIENCE (ZOOLOGY)'}"
BACHELOR OF SCIENCE (ZOOLOGY),"{'Cluster Subject 1': 'MAT A', 'Cluster Subject 2': 'BIO', 'Cluster Subject 3': 'BIO', 'Cluster Subject 4': 'BIO'}","{'Subject 1': {'MAT A': 'C'}, 'Subject 2': {'BIO': 'C+'}, 'Subject 3': {'CHE': 'C'}}","{'JOMO KENYATTA UNIVERSITY OF AGRICULTURE AND TECHNOLOGY': 'BACHELOR OF SCIENCE (ZOOLOGY)', 'MERU UNIVERSITY OF SCIENCE AND TECHNOLOGY': 'BACHELOR OF SCIENCE (ZOOLOGY)', 'RONGO UNIVERSITY': 'BACHELOR OF SCIENCE (ZOOLOGY)'}"
BACHELOR OF TECHNOLOGY (APPLIED BIOLOGY),"{'Cluster Subject 1': 'MAT A', 'Cluster Subject 2': 'BIO', 'Cluster Subject 3': 'BIO', 'Cluster Subject 4': 'BIO'}","{'Subject 1': {'MAT A': 'C'}, 'Subject 2': {'BIO': 'C+'}, 'Subject 3': {'CHE': 'C'}}",{'TECHNICAL UNIVERSITY OF KENYA': 'BACHELOR OF TECHNOLOGY (APPLIED BIOLOGY)'}
BACHELOR OF SCIENCE (APPLIED BIOLOGY),"{'Cluster Subject 1': 'MAT A', 'Cluster Subject 2': 'BIO', 'Cluster Subject 3': 'BIO', 'Cluster Subject 4': 'BIO'}","{'Subject 1': {'MAT A': 'C'}, 'Subject 2': {'BIO': 'C+'}, 'Subject 3': {'CHE': 'C'}}","{'UNIVERSITY OF EASTERN AFRICA, BARATON': 'BACHELOR OF SCIENCE IN BIOLOGY', 'CHUKA UNIVERSITY': 'BACHELOR OF SCIENCE IN BIOLOGY', 'CATHOLIC UNIVERSITY OF EAST AFRICA': 'BACHELOR OF SCIENCE IN BIOLOGY', 'JARAMOGI OGINGA ODINGA UNIVERSITY OF SCIENCE AND TECHNOLOGY': 'BACHELOR OF SCIENCE(BIOLOGICAL SCIENCES)', 'KIBABII UNIVERSITY': 'BACHELOR OF SCIENCE (BIOLOGY)', 'KENYA METHODIST UNIVERSITY': 'BACHELOR OF SCIENCE (APPLIED BIOLOGY)', 'MACHAKOS UNIVERSITY': 'BACHELOR OF SCIENCE IN BIOLOGY', 'MOUNT KENYA UNIVERSITY': 'BACHELOR OF SCIENCE (APPLIED BIOLOGY)', 'MASINDE MULIRO UNIVERSITY OF SCIENCE & TECHNOLOGY': 'BACHELOR OF SCIENCE (BIOLOGY)', 'UNIVERSITY OF EMBU': 'BACHELOR OF SCIENCE (BIOLOGY)'}"
BACHELOR OF SCIENCE IN CHEMISTRY,"{'Cluster Subject 1': 'MAT A', 'Cluster Subject 2': 'BIO', 'Cluster Subject 3': 'BIO', 'Cluster Subject 4': 'BIO'}","{'Subject 1': {'MAT A': 'C'}, 'Subject 2': {'CHE': 'C+'}}","{'UNIVERSITY OF EASTERN AFRICA, BARATON': 'BACHELOR OF SCIENCE IN CHEMISTRY', 'CHUKA UNIVERSITY': 'BACHELOR OF SCIENCE IN  CHEMISTRY', 'CATHOLIC UNIVERSITY OF EAST AFRICA': 'BACHELOR OF SCIENCE (CHEMISTRY)', 'DEDAN KIMATHI UNIVERSITY OF TECHNOLOGY': 'BACHELOR OF SCIENCE IN  POLYMER CHEMISTRY', 'KIBABII UNIVERSITY': 'BACHELOR OF SCIENCE (CHEMISTRY)', 'KISII UNIVERSITY': 'BACHELOR OF SCIENCE CHEMISTRY ( INORGANIC, PHYSICAL AND ORGANIC OPTIONS)', 'MAASAI MARA UNIVERSITY': 'BACHELOR OF SCIENCE (CHEMISTRY)', 'MASINDE MULIRO UNIVERSITY OF SCIENCE & TECHNOLOGY': 'BACHELOR OF SCIENCE (CHEMISTRY)', 'MERU UNIVERSITY OF SCIENCE AND TECHNOLOGY': 'BACHELOR OF SCIENCE CHEMISTRY ( INORGANIC, PHYSICAL AND ORGANIC OPTIONS)', 'PWANI UNIVERSITY': 'BACHELOR OF SCIENCE (CHEMISTRY)', 'RONGO UNIVERSITY': 'BACHELOR OF SCIENCE (CHEMISTRY)'}"
"BACHELOR OF SCIENCE CHEMISTRY ( INORGANIC, PHYSICAL AND ORGANIC OPTIONS)","{'Cluster Subject 1': 'MAT A', 'Cluster Subject 2': 'BIO', 'Cluster Subject 3': 'BIO', 'Cluster Subject 4': 'BIO'}","{'Subject 1': {'MAT A': 'C'}, 'Subject 2': {'CHE': 'C+'}}","{'UNIVERSITY OF EASTERN AFRICA, BARATON': 'BACHELOR OF SCIENCE IN CHEMISTRY', 'CHUKA UNIVERSITY': 'BACHELOR OF SCIENCE IN  CHEMISTRY', 'CATHOLIC UNIVERSITY OF EAST AFRICA': 'BACHELOR OF SCIENCE (CHEMISTRY)', 'DEDAN KIMATHI UNIVERSITY OF TECHNOLOGY': 'BACHELOR OF SCIENCE IN  POLYMER CHEMISTRY', 'KIBABII UNIVERSITY': 'BACHELOR OF SCIENCE (CHEMISTRY)', 'KISII UNIVERSITY': 'BACHELOR OF SCIENCE CHEMISTRY ( INORGANIC, PHYSICAL AND ORGANIC OPTIONS)', 'MAASAI MARA UNIVERSITY': 'BACHELOR OF SCIENCE (CHEMISTRY)', 'MASINDE MULIRO UNIVERSITY OF SCIENCE & TECHNOLOGY': 'BACHELOR OF SCIENCE (CHEMISTRY)', 'MERU UNIVERSITY OF SCIENCE AND TECHNOLOGY': 'BACHELOR OF SCIENCE CHEMISTRY ( INORGANIC, PHYSICAL AND ORGANIC OPTIONS)', 'PWANI UNIVERSITY': 'BACHELOR OF SCIENCE (CHEMISTRY)', 'RONGO UNIVERSITY': 'BACHELOR OF SCIENCE (CHEMISTRY)'}"
BACHELOR OF SCIENCE IN  POLYMER CHEMISTRY,"{'Cluster Subject 1': 'MAT A', 'Cluster Subject 2': 'BIO', 'Cluster Subject 3': 'BIO', 'Cluster Subject 4': 'BIO'}","{'Subject 1': {'MAT A': 'C'}, 'Subject 2': {'CHE': 'C+'}}","{'UNIVERSITY OF EASTERN AFRICA, BARATON': 'BACHELOR OF SCIENCE IN CHEMISTRY', 'CHUKA UNIVERSITY': 'BACHELOR OF SCIENCE IN  CHEMISTRY', 'CATHOLIC UNIVERSITY OF EAST AFRICA': 'BACHELOR OF SCIENCE (CHEMISTRY)', 'DEDAN KIMATHI UNIVERSITY OF TECHNOLOGY': 'BACHELOR OF SCIENCE IN  POLYMER CHEMISTRY', 'KIBABII UNIVERSITY': 'BACHELOR OF SCIENCE (CHEMISTRY)', 'KISII UNIVERSITY': 'BACHELOR OF SCIENCE CHEMISTRY ( INORGANIC, PHYSICAL AND ORGANIC OPTIONS)', 'MAASAI MARA UNIVERSITY': 'BACHELOR OF SCIENCE (CHEMISTRY)', 'MASINDE MULIRO UNIVERSITY OF SCIENCE & TECHNOLOGY': 'BACHELOR OF SCIENCE (CHEMISTRY)', 'MERU UNIVERSITY OF SCIENCE AND TECHNOLOGY': 'BACHELOR OF SCIENCE CHEMISTRY ( INORGANIC, PHYSICAL AND ORGANIC OPTIONS)', 'PWANI UNIVERSITY': 'BACHELOR OF SCIENCE (CHEMISTRY)', 'RONGO UNIVERSITY': 'BACHELOR OF SCIENCE (CHEMISTRY)'}"
BACHELOR OF SCIENCE (CHEMISTRY),"{'Cluster Subject 1': 'MAT A', 'Cluster Subject 2': 'BIO', 'Cluster Subject 3': 'BIO', 'Cluster Subject 4': 'BIO'}","{'Subject 1': {'MAT A': 'C'}, 'Subject 2': {'CHE': 'C+'}}","{'UNIVERSITY OF EASTERN AFRICA, BARATON': 'BACHELOR OF SCIENCE IN CHEMISTRY', 'CHUKA UNIVERSITY': 'BACHELOR OF SCIENCE IN  CHEMISTRY', 'CATHOLIC UNIVERSITY OF EAST AFRICA': 'BACHELOR OF SCIENCE (CHEMISTRY)', 'DEDAN KIMATHI UNIVERSITY OF TECHNOLOGY': 'BACHELOR OF SCIENCE IN  POLYMER CHEMISTRY', 'KIBABII UNIVERSITY': 'BACHELOR OF SCIENCE (CHEMISTRY)', 'KISII UNIVERSITY': 'BACHELOR OF SCIENCE CHEMISTRY ( INORGANIC, PHYSICAL AND ORGANIC OPTIONS)', 'MAASAI MARA UNIVERSITY': 'BACHELOR OF SCIENCE (CHEMISTRY)', 'MASINDE MULIRO UNIVERSITY OF SCIENCE & TECHNOLOGY': 'BACHELOR OF SCIENCE (CHEMISTRY)', 'MERU UNIVERSITY OF SCIENCE AND TECHNOLOGY': 'BACHELOR OF SCIENCE CHEMISTRY ( INORGANIC, PHYSICAL AND ORGANIC OPTIONS)', 'PWANI UNIVERSITY': 'BACHELOR OF SCIENCE (CHEMISTRY)', 'RONGO UNIVERSITY': 'BACHELOR OF SCIENCE (CHEMISTRY)'}"
BACHELOR OF SCIENCE IN  CHEMISTRY,"{'Cluster Subject 1': 'MAT A', 'Cluster Subject 2': 'BIO', 'Cluster Subject 3': 'BIO', 'Cluster Subject 4': 'BIO'}","{'Subject 1': {'MAT A': 'C'}, 'Subject 2': {'CHE': 'C+'}}","{'UNIVERSITY OF EASTERN AFRICA, BARATON': 'BACHELOR OF SCIENCE IN CHEMISTRY', 'CHUKA UNIVERSITY': 'BACHELOR OF SCIENCE IN  CHEMISTRY', 'CATHOLIC UNIVERSITY OF EAST AFRICA': 'BACHELOR OF SCIENCE (CHEMISTRY)', 'DEDAN KIMATHI UNIVERSITY OF TECHNOLOGY': 'BACHELOR OF SCIENCE IN  POLYMER CHEMISTRY', 'KIBABII UNIVERSITY': 'BACHELOR OF SCIENCE (CHEMISTRY)', 'KISII UNIVERSITY': 'BACHELOR OF SCIENCE CHEMISTRY ( INORGANIC, PHYSICAL AND ORGANIC OPTIONS)', 'MAASAI MARA UNIVERSITY': 'BACHELOR OF SCIENCE (CHEMISTRY)', 'MASINDE MULIRO UNIVERSITY OF SCIENCE & TECHNOLOGY': 'BACHELOR OF SCIENCE (CHEMISTRY)', 'MERU UNIVERSITY OF SCIENCE AND TECHNOLOGY': 'BACHELOR OF SCIENCE CHEMISTRY ( INORGANIC, PHYSICAL AND ORGANIC OPTIONS)', 'PWANI UNIVERSITY': 'BACHELOR OF SCIENCE (CHEMISTRY)', 'RONGO UNIVERSITY': 'BACHELOR OF SCIENCE (CHEMISTRY)'}"
BACHELOR OF SCIENCE (FORENSIC SCIENCE),"{'Cluster Subject 1': 'MAT A', 'Cluster Subject 2': 'BIO', 'Cluster Subject 3': 'BIO', 'Cluster Subject 4': 'BIO'}","{'Subject 1': {'MAT A': 'C'}, 'Subject 2': {'CHE': 'C+'}}",{'KIRINYAGA UNIVERSITY': 'BACHELOR OF SCIENCE (FORENSIC SCIENCE)'}
BACHELOR OF SCIENCE ( ENVIRONMENTAL CHEMISTRY),"{'Cluster Subject 1': 'MAT A', 'Cluster Subject 2': 'BIO', 'Cluster Subject 3': 'BIO', 'Cluster Subject 4': 'BIO'}","{'Subject 1': {'MAT A': 'C'}, 'Subject 2': {'CHE': 'C+'}}",{'KISII UNIVERSITY': 'BACHELOR OF SCIENCE ( ENVIRONMENTAL CHEMISTRY)'}
BACHELOR OF SCIENCE (CONSERVATION BIOLOGY),"{'Cluster Subject 1': 'MAT A', 'Cluster Subject 2': 'BIO', 'Cluster Subject 3': 'BIO', 'Cluster Subject 4': 'BIO'}","{'Subject 1': {'MAT A': 'C'}, 'Subject 2': {'BIO': 'C+'}, 'Subject 3': {'CHE': 'C'}}","{'KIBABII UNIVERSITY': 'BACHELOR OF SCIENCE ( BIO-RESOURCES MANAGEMENT AND CONSERVATION)', 'KENYATTA UNIVERSITY': 'BACHELOR OF SCIENCE (CONSERVATION BIOLOGY)'}"
BACHELOR OF SCIENCE (FORENSIC BIOLOGY),"{'Cluster Subject 1': 'MAT A', 'Cluster Subject 2': 'BIO', 'Cluster Subject 3': 'BIO', 'Cluster Subject 4': 'BIO'}","{'Subject 1': {'MAT A': 'C'}, 'Subject 2': {'BIO': 'C+'}, 'Subject 3': {'CHE': 'C'}}",{'KISII UNIVERSITY': 'BACHELOR OF SCIENCE (FORENSIC BIOLOGY)'}
BACHELOR OF SCIENCE IN ENVIRONMENTAL HEALTH,"{'Cluster Subject 1': 'BIO', 'Cluster Subject 2': 'CHE', 'Cluster Subject 3': 'MAT A', 'Cluster Subject 4': 'ENG'}","{'Subject 1': {'BIO': 'C+'}, 'Subject 2': {'CHE': 'C+'}, 'Subject 3': {'MAT A': 'C+'}, 'Subject 4': {'ENG': 'C+'}}","{'ALUPE UNIVERSITY COLLEGE': 'BACHELOR OF SCIENCE (ENVIRONMENTAL HEALTH)', 'BOMET UNIVERSITY COLLEGE': 'BACHELOR OF SCIENCE IN ENVIRONMENTAL HEALTH', 'DAYSTAR UNIVERSITY': 'BACHELOR OF SCIENCE IN ENVIRONMENTAL HEALTH', 'KIRINYAGA UNIVERSITY': 'BACHELOR OF SCIENCE IN ENVIRONMENTAL HEALTH', 'KENYATTA UNIVERSITY - MAMA NGINA UNIVERSITY COLLEGE': 'BACHELOR OF SCIENCE (ENVIRONMENTAL HEALTH)', 'MURANGA UNIVERSITY OF TECHNOLOGY': 'BACHELOR OF SCIENCE IN ENVIRONMENTAL HEALTH', 'PWANI UNIVERSITY': 'BACHELOR OF SCIENCE IN ENVIRONMENTAL HEALTH'}"
BACHELOR OF SCIENCE IN HEALTH EDUCATION AND PROMOTION,"{'Cluster Subject 1': 'BIO', 'Cluster Subject 2': 'CHE', 'Cluster Subject 3': 'MAT A', 'Cluster Subject 4': 'ENG'}","{'Subject 1': {'BIO': 'C+'}, 'Subject 2': {'CHE': 'C+'}, 'Subject 3': {'MAT A': 'C+'}, 'Subject 4': {'ENG': 'C+'}}",{'MOUNT KENYA UNIVERSITY': 'BACHELOR OF SCIENCE IN HEALTH EDUCATION AND PROMOTION'}
BACHELOR OF SCIENCE (ENVIRONMENTAL HEALTH),"{'Cluster Subject 1': 'BIO', 'Cluster Subject 2': 'CHE', 'Cluster Subject 3': 'MAT A', 'Cluster Subject 4': 'ENG'}","{'Subject 1': {'BIO': 'C+'}, 'Subject 2': {'CHE': 'C+'}, 'Subject 3': {'MAT A': 'C+'}, 'Subject 4': {'ENG': 'C+'}}","{'ALUPE UNIVERSITY COLLEGE': 'BACHELOR OF SCIENCE (ENVIRONMENTAL HEALTH)', 'BOMET UNIVERSITY COLLEGE': 'BACHELOR OF SCIENCE IN ENVIRONMENTAL HEALTH', 'DAYSTAR UNIVERSITY': 'BACHELOR OF SCIENCE IN ENVIRONMENTAL HEALTH', 'KIRINYAGA UNIVERSITY': 'BACHELOR OF SCIENCE IN ENVIRONMENTAL HEALTH', 'KENYATTA UNIVERSITY - MAMA NGINA UNIVERSITY COLLEGE': 'BACHELOR OF SCIENCE (ENVIRONMENTAL HEALTH)', 'MURANGA UNIVERSITY OF TECHNOLOGY': 'BACHELOR OF SCIENCE IN ENVIRONMENTAL HEALTH', 'PWANI UNIVERSITY': 'BACHELOR OF SCIENCE IN ENVIRONMENTAL HEALTH'}"
BACHELOR OF SCIENCE IN COMMUNITY HEALTH AND DEVELOPMENT,"{'Cluster Subject 1': 'BIO', 'Cluster Subject 2': 'CHE', 'Cluster Subject 3': 'MAT A', 'Cluster Subject 4': 'ENG'}","{'Subject 1': {'BIO': 'C+'}, 'Subject 2': {'CHE': 'C+'}, 'Subject 3': {'MAT A': 'C+'}, 'Subject 4': {'ENG': 'C+'}}","{'AMREF INTERNATIONAL UNIVERSITY': 'BACHELOR OF SCIENCE IN COMMUNITY HEALTH', 'CATHOLIC UNIVERSITY OF EAST AFRICA': 'BACHELOR OF SCIENCE IN COMMUNITY HEALTH AND DEVELOPMENT', 'JARAMOGI OGINGA ODINGA UNIVERSITY OF SCIENCE AND TECHNOLOGY': 'BACHELOR OF SCIENCE (COMMUNITY HEALTH AND DEVELOPMENT)', 'KIRINYAGA UNIVERSITY': 'BACHELOR OF SCIENCE (COMMUNITY HEALTH & DEVELOPMENT)', 'MERU UNIVERSITY OF SCIENCE AND TECHNOLOGY': 'BACHELOR OF SCIENCE (COMMUNITY HEALTH & DEVELOPMENT)', 'MURANGA UNIVERSITY OF TECHNOLOGY': 'BACHELOR OF SCIENCE IN COMMUNITY HEALTH', 'TURKANA UNIVERSITY COLLEGE': 'BACHELOR OF SCIENCE IN COMMUNITY HEALTH AND DEVELOPMENT', 'UNIVERSITY OF EMBU': 'BACHELOR OF SCIENCE IN COMMUNITY HEALTH AND DEVELOPMENT'}"
BACHELOR OF SCIENCE (MEDICAL PSYCHOLOGY),"{'Cluster Subject 1': 'BIO', 'Cluster Subject 2': 'CHE', 'Cluster Subject 3': 'MAT A', 'Cluster Subject 4': 'ENG'}","{'Subject 1': {'BIO': 'C+'}, 'Subject 2': {'MAT A': 'C+'}}","{'ALUPE UNIVERSITY COLLEGE': 'BACHELOR OF SCIENCE (MEDICAL PSYCHOLOGY)', 'INTERNATIONAL LEADERSHIP UNIVERSITY': 'BACHELOR OF ARTS IN COUNSELLING PSYCHOLOGY', 'KENYA ASSEMBLIES OF GOD EAST UNIVERSITY': 'BACHELOR OF COUNSELING PSYCHOLOGY', 'KENYA HIGHLANDS EVANGELICAL UNIVERSITY': 'BACHELOR OF ARTS IN COUNSELING PSYCHOLOGY', 'SCOTT CHRISTIAN UNIVERSITY': 'BACHELOR OF ARTS IN COUNSELING PSYCHOLOGY', 'THARAKA UNIVERSITY COLLEGE': 'BACHELOR OF ARTS (PSYCHOLOGY)', 'TANGAZA UNIVERSITY COLLEGE': 'BACHELOR OF ARTS IN COUNSELING PSYCHOLOGY'}"
BACHELOR OF SCIENCE (COMMUNITY HEALTH AND DEVELOPMENT),"{'Cluster Subject 1': 'BIO', 'Cluster Subject 2': 'CHE', 'Cluster Subject 3': 'MAT A', 'Cluster Subject 4': 'ENG'}","{'Subject 1': {'BIO': 'C+'}, 'Subject 2': {'CHE': 'C+'}, 'Subject 3': {'MAT A': 'C+'}, 'Subject 4': {'ENG': 'C+'}}","{'AMREF INTERNATIONAL UNIVERSITY': 'BACHELOR OF SCIENCE IN COMMUNITY HEALTH', 'CATHOLIC UNIVERSITY OF EAST AFRICA': 'BACHELOR OF SCIENCE IN COMMUNITY HEALTH AND DEVELOPMENT', 'JARAMOGI OGINGA ODINGA UNIVERSITY OF SCIENCE AND TECHNOLOGY': 'BACHELOR OF SCIENCE (COMMUNITY HEALTH AND DEVELOPMENT)', 'KIRINYAGA UNIVERSITY': 'BACHELOR OF SCIENCE (COMMUNITY HEALTH & DEVELOPMENT)', 'MERU UNIVERSITY OF SCIENCE AND TECHNOLOGY': 'BACHELOR OF SCIENCE (COMMUNITY HEALTH & DEVELOPMENT)', 'MURANGA UNIVERSITY OF TECHNOLOGY': 'BACHELOR OF SCIENCE IN COMMUNITY HEALTH', 'TURKANA UNIVERSITY COLLEGE': 'BACHELOR OF SCIENCE IN COMMUNITY HEALTH AND DEVELOPMENT', 'UNIVERSITY OF EMBU': 'BACHELOR OF SCIENCE IN COMMUNITY HEALTH AND DEVELOPMENT'}"
BACHELOR OF SCIENCE (COMMUNITY HEALTH & DEVELOPMENT),"{'Cluster Subject 1': 'BIO', 'Cluster Subject 2': 'CHE', 'Cluster Subject 3': 'MAT A', 'Cluster Subject 4': 'ENG'}","{'Subject 1': {'BIO': 'C+'}, 'Subject 2': {'CHE': 'C+'}, 'Subject 3': {'MAT A': 'C+'}, 'Subject 4': {'ENG': 'C+'}}","{'AMREF INTERNATIONAL UNIVERSITY': 'BACHELOR OF SCIENCE IN COMMUNITY HEALTH', 'CATHOLIC UNIVERSITY OF EAST AFRICA': 'BACHELOR OF SCIENCE IN COMMUNITY HEALTH AND DEVELOPMENT', 'JARAMOGI OGINGA ODINGA UNIVERSITY OF SCIENCE AND TECHNOLOGY': 'BACHELOR OF SCIENCE (COMMUNITY HEALTH AND DEVELOPMENT)', 'KIRINYAGA UNIVERSITY': 'BACHELOR OF SCIENCE (COMMUNITY HEALTH & DEVELOPMENT)', 'MERU UNIVERSITY OF SCIENCE AND TECHNOLOGY': 'BACHELOR OF SCIENCE (COMMUNITY HEALTH & DEVELOPMENT)', 'MURANGA UNIVERSITY OF TECHNOLOGY': 'BACHELOR OF SCIENCE IN COMMUNITY HEALTH', 'TURKANA UNIVERSITY COLLEGE': 'BACHELOR OF SCIENCE IN COMMUNITY HEALTH AND DEVELOPMENT', 'UNIVERSITY OF EMBU': 'BACHELOR OF SCIENCE IN COMMUNITY HEALTH AND DEVELOPMENT'}"
BACHELOR OF SCIENCE IN COMMUNITY HEALTH,"{'Cluster Subject 1': 'BIO', 'Cluster Subject 2': 'CHE', 'Cluster Subject 3': 'MAT A', 'Cluster Subject 4': 'ENG'}","{'Subject 1': {'BIO': 'C+'}, 'Subject 2': {'CHE': 'C+'}, 'Subject 3': {'MAT A': 'C+'}, 'Subject 4': {'ENG': 'C+'}}","{'AMREF INTERNATIONAL UNIVERSITY': 'BACHELOR OF SCIENCE IN COMMUNITY HEALTH', 'CATHOLIC UNIVERSITY OF EAST AFRICA': 'BACHELOR OF SCIENCE IN COMMUNITY HEALTH AND DEVELOPMENT', 'JARAMOGI OGINGA ODINGA UNIVERSITY OF SCIENCE AND TECHNOLOGY': 'BACHELOR OF SCIENCE (COMMUNITY HEALTH AND DEVELOPMENT)', 'KIRINYAGA UNIVERSITY': 'BACHELOR OF SCIENCE (COMMUNITY HEALTH & DEVELOPMENT)', 'MERU UNIVERSITY OF SCIENCE AND TECHNOLOGY': 'BACHELOR OF SCIENCE (COMMUNITY HEALTH & DEVELOPMENT)', 'MURANGA UNIVERSITY OF TECHNOLOGY': 'BACHELOR OF SCIENCE IN COMMUNITY HEALTH', 'TURKANA UNIVERSITY COLLEGE': 'BACHELOR OF SCIENCE IN COMMUNITY HEALTH AND DEVELOPMENT', 'UNIVERSITY OF EMBU': 'BACHELOR OF SCIENCE IN COMMUNITY HEALTH AND DEVELOPMENT'}"
BACHELOR OF ARTS (GERMAN),"{'Cluster Subject 1': 'GER', 'Cluster Subject 2': 'ENG', 'Cluster Subject 3': 'MAT A', 'Cluster Subject 4': 'BIO'}",{'Subject 1': {'GER': 'C+'}},{'PWANI UNIVERSITY': 'BACHELOR OF ARTS (GERMAN)'}
BACHELOR OF ARTS (FRENCH),"{'Cluster Subject 1': 'FRE', 'Cluster Subject 2': 'ENG', 'Cluster Subject 3': 'MAT A', 'Cluster Subject 4': 'BIO'}",{'Subject 1': {'FRE': 'C+'}},"{'KAIMOSI FRIENDS UNIVERSITY COLLEGE': 'BACHELOR OF EDUCATION (FRENCH)', 'PWANI UNIVERSITY': 'BACHELOR OF ARTS (FRENCH)', 'TOM MBOYA UNIVERSITY COLLEGE': 'BACHELOR OF EDUCATION (FRENCH, WITH IT)'}"
"BACHELOR OF EDUCATION (FRENCH, WITH IT)","{'Cluster Subject 1': 'FRE', 'Cluster Subject 2': 'ENG', 'Cluster Subject 3': 'MAT A', 'Cluster Subject 4': 'BIO'}",{'Subject 1': {'FRE': 'C+'}},"{'KAIMOSI FRIENDS UNIVERSITY COLLEGE': 'BACHELOR OF EDUCATION (FRENCH)', 'PWANI UNIVERSITY': 'BACHELOR OF ARTS (FRENCH)', 'TOM MBOYA UNIVERSITY COLLEGE': 'BACHELOR OF EDUCATION (FRENCH, WITH IT)'}"
BACHELOR OF EDUCATION (FRENCH),"{'Cluster Subject 1': 'FRE', 'Cluster Subject 2': 'ENG', 'Cluster Subject 3': 'MAT A', 'Cluster Subject 4': 'BIO'}",{'Subject 1': {'FRE': 'C+'}},"{'KAIMOSI FRIENDS UNIVERSITY COLLEGE': 'BACHELOR OF EDUCATION (FRENCH)', 'PWANI UNIVERSITY': 'BACHELOR OF ARTS (FRENCH)', 'TOM MBOYA UNIVERSITY COLLEGE': 'BACHELOR OF EDUCATION (FRENCH, WITH IT)'}"
"BACHELOR OF ARTS (MUSIC, WITH IT)","{'Cluster Subject 1': 'MUC', 'Cluster Subject 2': 'ENG', 'Cluster Subject 3': 'MAT A', 'Cluster Subject 4': 'BIO'}",{'Subject 1': {'MUC': 'C+'}},"{'UNIVERSITY OF EASTERN AFRICA, BARATON': 'BACHELOR OF ARTS (MUSIC)', 'MASENO UNIVERSITY': 'BACHELOR OF ARTS (MUSIC, WITH IT)'}"
BACHELOR OF MUSIC (TECHNOLOGY),"{'Cluster Subject 1': 'MUC', 'Cluster Subject 2': 'ENG', 'Cluster Subject 3': 'MAT A', 'Cluster Subject 4': 'BIO'}",{'Subject 1': {'MUC': 'C+'}},{'KENYATTA UNIVERSITY': 'BACHELOR OF MUSIC (TECHNOLOGY)'}
BACHELOR OF ARTS (MUSIC),"{'Cluster Subject 1': 'MUC', 'Cluster Subject 2': 'ENG', 'Cluster Subject 3': 'MAT A', 'Cluster Subject 4': 'BIO'}",{'Subject 1': {'MUC': 'C+'}},"{'UNIVERSITY OF EASTERN AFRICA, BARATON': 'BACHELOR OF ARTS (MUSIC)', 'MASENO UNIVERSITY': 'BACHELOR OF ARTS (MUSIC, WITH IT)'}"
BACHELOR OF COMMERCE (B.COM),"{'Cluster Subject 1': 'ENG', 'Cluster Subject 2': 'MAT A', 'Cluster Subject 3': 'BIO', 'Cluster Subject 4': 'BIO'}",{'Subject 1': {'MAT A': 'C'}},"{'GRETSA UNIVERSITY': 'BACHELOR OF COMMERCE', 'KAIMOSI FRIENDS UNIVERSITY COLLEGE': 'BACHELOR OF COMMERCE', 'KOITALEEL SAMOEI UNIVERSITY COLLEGE': 'BACHELOR OF COMMERCE', 'KIRINYAGA UNIVERSITY': 'BACHELOR OF COMMERCE', 'LUKENYA UNIVERSITY': 'BACHELOR OF COMMERCE', 'MANAGEMENT UNIVERSITY OF AFRICA': 'BACHELOR OF COMMERCE', 'MERU UNIVERSITY OF SCIENCE AND TECHNOLOGY': 'BACHELOR OF COMMERCE (B.COM)', 'MURANGA UNIVERSITY OF TECHNOLOGY': 'BACHELOR OF COMMERCE', 'PAN AFRICA CHRISTIAN UNIVERSITY': 'BACHELOR OF COMMERCE', 'PIONEER INTERNATIONAL UNIVERSITY': 'BACHELOR OF COMMERCE (B.COM)', 'SOUTH EASTERN KENYA UNIVERSITY': 'BACHELOR OF COMMERCE', 'ST PAULS UNIVERSITY': 'BACHELOR OF COMMERCE (B.COM)', 'THARAKA UNIVERSITY COLLEGE': 'BACHELOR OF COMMERCE (B.COM)', 'TAITA TAVETA UNIVERSITY': 'BACHELOR OF COMMERCE (B.COM)', 'UMMA UNIVERSITY': 'BACHELOR OF COMMERCE (B.COM)', 'ZETECH UNIVERSITY': 'BACHELOR OF COMMERCE (B.COM)'}"
BACHELOR OF SCIENCE (RECORDS MANAGEMENT AND INFORMATION TECHNOLOGY),"{'Cluster Subject 1': 'ENG', 'Cluster Subject 2': 'MAT A', 'Cluster Subject 3': 'BIO', 'Cluster Subject 4': 'BIO'}",{'Subject 1': {'MAT A': 'C'}},{'KENYA HIGHLANDS EVANGELICAL UNIVERSITY': 'BACHELOR OF SCIENCE (RECORDS MANAGEMENT AND INFORMATION TECHNOLOGY)'}
BACHELOR OF COMMERCE,"{'Cluster Subject 1': 'ENG', 'Cluster Subject 2': 'MAT A', 'Cluster Subject 3': 'BIO', 'Cluster Subject 4': 'BIO'}",{'Subject 1': {'MAT A': 'C'}},"{'GRETSA UNIVERSITY': 'BACHELOR OF COMMERCE', 'KAIMOSI FRIENDS UNIVERSITY COLLEGE': 'BACHELOR OF COMMERCE', 'KOITALEEL SAMOEI UNIVERSITY COLLEGE': 'BACHELOR OF COMMERCE', 'KIRINYAGA UNIVERSITY': 'BACHELOR OF COMMERCE', 'LUKENYA UNIVERSITY': 'BACHELOR OF COMMERCE', 'MANAGEMENT UNIVERSITY OF AFRICA': 'BACHELOR OF COMMERCE', 'MERU UNIVERSITY OF SCIENCE AND TECHNOLOGY': 'BACHELOR OF COMMERCE (B.COM)', 'MURANGA UNIVERSITY OF TECHNOLOGY': 'BACHELOR OF COMMERCE', 'PAN AFRICA CHRISTIAN UNIVERSITY': 'BACHELOR OF COMMERCE', 'PIONEER INTERNATIONAL UNIVERSITY': 'BACHELOR OF COMMERCE (B.COM)', 'SOUTH EASTERN KENYA UNIVERSITY': 'BACHELOR OF COMMERCE', 'ST PAULS UNIVERSITY': 'BACHELOR OF COMMERCE (B.COM)', 'THARAKA UNIVERSITY COLLEGE': 'BACHELOR OF COMMERCE (B.COM)', 'TAITA TAVETA UNIVERSITY': 'BACHELOR OF COMMERCE (B.COM)', 'UMMA UNIVERSITY': 'BACHELOR OF COMMERCE (B.COM)', 'ZETECH UNIVERSITY': 'BACHELOR OF COMMERCE (B.COM)'}"
BACHELOR OF SCIENCE (INFORMATION SCIENCES AND KNOWLEDGE MANAGEMENT),"{'Cluster Subject 1': 'ENG', 'Cluster Subject 2': 'MAT A', 'Cluster Subject 3': 'BIO', 'Cluster Subject 4': 'BIO'}",{'Subject 1': {'MAT A': 'C'}},"{'CHUKA UNIVERSITY': 'BACHELOR OF SCIENCE IN INFORMATION SCIENCE', 'GARISSA UNIVERSITY': 'BACHELOR OF SCIENCE IN INFORMATION SCIENCES', 'KARATINA UNIVERSITY': 'BACHELOR OF SCIENCE IN INFORMATION SCIENCES', 'KENYA METHODIST UNIVERSITY': 'BACHELOR OF SCIENCE IN INFORMATION SCIENCE', 'MOUNT KENYA UNIVERSITY': 'BACHELOR OF SCIENCE IN INFORMATION SCIENCE', 'MAASAI MARA UNIVERSITY': 'BACHELOR OF SCIENCE (INFORMATION SCIENCE)', 'MERU UNIVERSITY OF SCIENCE AND TECHNOLOGY': 'BACHELOR OF SCIENCE IN INFORMATION SCIENCE', 'RONGO UNIVERSITY': 'BACHELOR OF SCIENCE (INFORMATION SCIENCE)', 'TECHNICAL UNIVERSITY OF MOMBASA': 'BACHELOR OF SCIENCE IN INFORMATION SCIENCE', 'UNIVERSITY OF KABIANGA': 'BACHELOR OF SCIENCE (INFORMATION SCIENCES AND KNOWLEDGE MANAGEMENT)'}"
BACHELOR OF SCIENCE IN INFORMATION SCIENCE,"{'Cluster Subject 1': 'ENG', 'Cluster Subject 2': 'MAT A', 'Cluster Subject 3': 'BIO', 'Cluster Subject 4': 'BIO'}",{'Subject 1': {'MAT A': 'C'}},"{'CHUKA UNIVERSITY': 'BACHELOR OF SCIENCE IN INFORMATION SCIENCE', 'GARISSA UNIVERSITY': 'BACHELOR OF SCIENCE IN INFORMATION SCIENCES', 'KARATINA UNIVERSITY': 'BACHELOR OF SCIENCE IN INFORMATION SCIENCES', 'KENYA METHODIST UNIVERSITY': 'BACHELOR OF SCIENCE IN INFORMATION SCIENCE', 'MOUNT KENYA UNIVERSITY': 'BACHELOR OF SCIENCE IN INFORMATION SCIENCE', 'MAASAI MARA UNIVERSITY': 'BACHELOR OF SCIENCE (INFORMATION SCIENCE)', 'MERU UNIVERSITY OF SCIENCE AND TECHNOLOGY': 'BACHELOR OF SCIENCE IN INFORMATION SCIENCE', 'RONGO UNIVERSITY': 'BACHELOR OF SCIENCE (INFORMATION SCIENCE)', 'TECHNICAL UNIVERSITY OF MOMBASA': 'BACHELOR OF SCIENCE IN INFORMATION SCIENCE', 'UNIVERSITY OF KABIANGA': 'BACHELOR OF SCIENCE (INFORMATION SCIENCES AND KNOWLEDGE MANAGEMENT)'}"
BACHELOR OF SCIENCE (INFORMATION SCIENCE),"{'Cluster Subject 1': 'ENG', 'Cluster Subject 2': 'MAT A', 'Cluster Subject 3': 'BIO', 'Cluster Subject 4': 'BIO'}",{'Subject 1': {'MAT A': 'C'}},"{'CHUKA UNIVERSITY': 'BACHELOR OF SCIENCE IN INFORMATION SCIENCE', 'GARISSA UNIVERSITY': 'BACHELOR OF SCIENCE IN INFORMATION SCIENCES', 'KARATINA UNIVERSITY': 'BACHELOR OF SCIENCE IN INFORMATION SCIENCES', 'KENYA METHODIST UNIVERSITY': 'BACHELOR OF SCIENCE IN INFORMATION SCIENCE', 'MOUNT KENYA UNIVERSITY': 'BACHELOR OF SCIENCE IN INFORMATION SCIENCE', 'MAASAI MARA UNIVERSITY': 'BACHELOR OF SCIENCE (INFORMATION SCIENCE)', 'MERU UNIVERSITY OF SCIENCE AND TECHNOLOGY': 'BACHELOR OF SCIENCE IN INFORMATION SCIENCE', 'RONGO UNIVERSITY': 'BACHELOR OF SCIENCE (INFORMATION SCIENCE)', 'TECHNICAL UNIVERSITY OF MOMBASA': 'BACHELOR OF SCIENCE IN INFORMATION SCIENCE', 'UNIVERSITY OF KABIANGA': 'BACHELOR OF SCIENCE (INFORMATION SCIENCES AND KNOWLEDGE MANAGEMENT)'}"
BACHELOR OF SCIENCE IN INFORMATION SCIENCES,"{'Cluster Subject 1': 'ENG', 'Cluster Subject 2': 'MAT A', 'Cluster Subject 3': 'BIO', 'Cluster Subject 4': 'BIO'}",{'Subject 1': {'MAT A': 'C'}},"{'CHUKA UNIVERSITY': 'BACHELOR OF SCIENCE IN INFORMATION SCIENCE', 'GARISSA UNIVERSITY': 'BACHELOR OF SCIENCE IN INFORMATION SCIENCES', 'KARATINA UNIVERSITY': 'BACHELOR OF SCIENCE IN INFORMATION SCIENCES', 'KENYA METHODIST UNIVERSITY': 'BACHELOR OF SCIENCE IN INFORMATION SCIENCE', 'MOUNT KENYA UNIVERSITY': 'BACHELOR OF SCIENCE IN INFORMATION SCIENCE', 'MAASAI MARA UNIVERSITY': 'BACHELOR OF SCIENCE (INFORMATION SCIENCE)', 'MERU UNIVERSITY OF SCIENCE AND TECHNOLOGY': 'BACHELOR OF SCIENCE IN INFORMATION SCIENCE', 'RONGO UNIVERSITY': 'BACHELOR OF SCIENCE (INFORMATION SCIENCE)', 'TECHNICAL UNIVERSITY OF MOMBASA': 'BACHELOR OF SCIENCE IN INFORMATION SCIENCE', 'UNIVERSITY OF KABIANGA': 'BACHELOR OF SCIENCE (INFORMATION SCIENCES AND KNOWLEDGE MANAGEMENT)'}"
