Cluster Subject 1,Cluster Subject 2,Cluster Subject 3,Cluster Subject 4,KIRINYAGA UNIVERSITY,MAT A,PHY,degree
BACHELOR OF ECONOMICS AND STATISTICS,"{'Cluster Subject 1': 'MAT A', 'Cluster Subject 2': 'BIO', 'Cluster Subject 3': 'HAG', 'Cluster Subject 4': 'BIO'}",{'Subject 1': {'MAT A': 'C+'}},"{'ALUPE UNIVERSITY COLLEGE': 'BACHELOR OF ARTS (ECONOMICS)', 'UNIVERSITY OF EASTERN AFRICA, BARATON': 'BACHELOR OF BUSINESS ADMINISTRATION IN FINANCE', 'BOMET UNIVERSITY COLLEGE': 'BACHELOR OF ARTS (ECONOMICS)', 'CHUKA UNIVERSITY': 'BACHELOR OF ARTS (ECONOMICS & SOCIOLOGY)', 'CATHOLIC UNIVERSITY OF EAST AFRICA': 'BACHELOR OF ARTS IN ECONOMICS', 'GARISSA UNIVERSITY': 'BACHELOR OF ARTS IN ECONOMICS', 'KAIMOSI FRIENDS UNIVERSITY COLLEGE': 'BACHELOR OF SCIENCE IN ECONOMICS', 'KARATINA UNIVERSITY': 'BACHELOR OF ECONOMICS', 'KCA UNIVERSITY': 'BACHELOR OF ARTS IN ECONOMICS AND BUSINESS STUDIES', 'KISII UNIVERSITY': 'BACHELOR OF ECONOMICS AND STATISTICS', 'KIRINYAGA UNIVERSITY': 'BACHELOR OF ECONOMICS & STATISTICS', 'LAIKIPIA UNIVERSITY': 'BACHELOR OF SCIENCE (ECONOMICS AND STATISTICS)', 'MACHAKOS UNIVERSITY': 'BACHELOR OF ECONOMICS', 'MAASAI MARA UNIVERSITY': 'BACHELOR OF SCIENCE (ECONOMICS & STATISTICS)', 'MASENO UNIVERSITY': 'BACHELOR OF ARTS (ECONOMICS, WITH IT)', 'MERU UNIVERSITY OF SCIENCE AND TECHNOLOGY': 'BACHELOR OF SCIENCE IN ECONOMICS', 'PWANI UNIVERSITY': 'BACHELOR OF ARTS (ECONOMICS)', 'RONGO UNIVERSITY': 'BACHELOR OF ARTS (ECONOMICS)', 'SOUTH EASTERN KENYA UNIVERSITY': 'BACHELOR OF ECONOMICS', 'THARAKA UNIVERSITY COLLEGE': 'BACHELOR OF SCIENCE (ECONOMICS AND STATISTICS)', 'TOM MBOYA UNIVERSITY COLLEGE': 'BACHELOR OF ARTS (ECONOMICS, WITH IT)', 'TURKANA UNIVERSITY COLLEGE': 'BACHELOR OF SCIENCE IN ECONOMICS', 'TAITA TAVETA UNIVERSITY': 'BACHELOR OF ECONOMICS', 'UNIVERSITY OF ELDORET': 'BACHELOR OF ARTS (ECONOMICS)', 'UNIVERSITY OF EMBU': 'BACHELOR OF ECONOMICS AND STATISTICS', 'UNIVERSITY OF KABIANGA': 'BACHELOR OF ARTS (ECONOMICS)', 'ZETECH UNIVERSITY': 'BACHELOR OF ECONOMICS AND STATISTICS'}"
BACHELOR OF ECONOMICS & STATISTICS,"{'Cluster Subject 1': 'MAT A', 'Cluster Subject 2': 'BIO', 'Cluster Subject 3': 'HAG', 'Cluster Subject 4': 'BIO'}",{'Subject 1': {'MAT A': 'C+'}},"{'ALUPE UNIVERSITY COLLEGE': 'BACHELOR OF ARTS (ECONOMICS)', 'UNIVERSITY OF EASTERN AFRICA, BARATON': 'BACHELOR OF BUSINESS ADMINISTRATION IN FINANCE', 'BOMET UNIVERSITY COLLEGE': 'BACHELOR OF ARTS (ECONOMICS)', 'CHUKA UNIVERSITY': 'BACHELOR OF ARTS (ECONOMICS & SOCIOLOGY)', 'CATHOLIC UNIVERSITY OF EAST AFRICA': 'BACHELOR OF ARTS IN ECONOMICS', 'GARISSA UNIVERSITY': 'BACHELOR OF ARTS IN ECONOMICS', 'KAIMOSI FRIENDS UNIVERSITY COLLEGE': 'BACHELOR OF SCIENCE IN ECONOMICS', 'KARATINA UNIVERSITY': 'BACHELOR OF ECONOMICS', 'KCA UNIVERSITY': 'BACHELOR OF ARTS IN ECONOMICS AND BUSINESS STUDIES', 'KISII UNIVERSITY': 'BACHELOR OF ECONOMICS AND STATISTICS', 'KIRINYAGA UNIVERSITY': 'BACHELOR OF ECONOMICS & STATISTICS', 'LAIKIPIA UNIVERSITY': 'BACHELOR OF SCIENCE (ECONOMICS AND STATISTICS)', 'MACHAKOS UNIVERSITY': 'BACHELOR OF ECONOMICS', 'MAASAI MARA UNIVERSITY': 'BACHELOR OF SCIENCE (ECONOMICS & STATISTICS)', 'MASENO UNIVERSITY': 'BACHELOR OF ARTS (ECONOMICS, WITH IT)', 'MERU UNIVERSITY OF SCIENCE AND TECHNOLOGY': 'BACHELOR OF SCIENCE IN ECONOMICS', 'PWANI UNIVERSITY': 'BACHELOR OF ARTS (ECONOMICS)', 'RONGO UNIVERSITY': 'BACHELOR OF ARTS (ECONOMICS)', 'SOUTH EASTERN KENYA UNIVERSITY': 'BACHELOR OF ECONOMICS', 'THARAKA UNIVERSITY COLLEGE': 'BACHELOR OF SCIENCE (ECONOMICS AND STATISTICS)', 'TOM MBOYA UNIVERSITY COLLEGE': 'BACHELOR OF ARTS (ECONOMICS, WITH IT)', 'TURKANA UNIVERSITY COLLEGE': 'BACHELOR OF SCIENCE IN ECONOMICS', 'TAITA TAVETA UNIVERSITY': 'BACHELOR OF ECONOMICS', 'UNIVERSITY OF ELDORET': 'BACHELOR OF ARTS (ECONOMICS)', 'UNIVERSITY OF EMBU': 'BACHELOR OF ECONOMICS AND STATISTICS', 'UNIVERSITY OF KABIANGA': 'BACHELOR OF ARTS (ECONOMICS)', 'ZETECH UNIVERSITY': 'BACHELOR OF ECONOMICS AND STATISTICS'}"
BACHELOR OF SCIENCE (MATHEMATICS WITH COMPUTING),"{'Cluster Subject 1': 'MAT A', 'Cluster Subject 2': 'BIO', 'Cluster Subject 3': 'HAG', 'Cluster Subject 4': 'BIO'}",{'Subject 1': {'MAT A': 'C+'}},"{'KENYA METHODIST UNIVERSITY': 'BACHELOR OF SCIENCE IN MATHEMATICS AND COMPUTER SCIENCE', 'KIRINYAGA UNIVERSITY': 'BACHELOR OF SCIENCE (MATHEMATICS AND COMPUTER SCIENCE)', 'MERU UNIVERSITY OF SCIENCE AND TECHNOLOGY': 'BACHELOR OF SCIENCE (MATHEMATICS & COMPUTER SCIENCE)', 'TOM MBOYA UNIVERSITY COLLEGE': 'BACHELOR OF SCIENCE (MATHEMATICS & COMPUTER SCIENCE)', 'TAITA TAVETA UNIVERSITY': 'BACHELOR OF SCIENCE (MATHEMATICS AND COMPUTER SCIENCE)', 'UNIVERSITY OF EMBU': 'BACHELOR OF SCIENCE (MATHEMATICS WITH COMPUTING)'}"
BACHELOR OF ARTS IN HISTORY AND ECONOMICS,"{'Cluster Subject 1': 'MAT A', 'Cluster Subject 2': 'BIO', 'Cluster Subject 3': 'HAG', 'Cluster Subject 4': 'BIO'}",{'Subject 1': {'MAT A': 'C+'}},"{'CHUKA UNIVERSITY': 'BACHELOR OF ARTS IN HISTORY AND ECONOMICS', 'EGERTON UNIVERSITY': 'BACHELOR OF ARTS (HISTORY & ECONOMICS)'}"
BACHELOR OF SCIENCE IN FINANCIAL ECONOMICS,"{'Cluster Subject 1': 'MAT A', 'Cluster Subject 2': 'BIO', 'Cluster Subject 3': 'HAG', 'Cluster Subject 4': 'BIO'}",{'Subject 1': {'MAT A': 'C+'}},"{'ALUPE UNIVERSITY COLLEGE': 'BACHELOR OF ARTS (ECONOMICS)', 'UNIVERSITY OF EASTERN AFRICA, BARATON': 'BACHELOR OF BUSINESS ADMINISTRATION IN FINANCE', 'BOMET UNIVERSITY COLLEGE': 'BACHELOR OF ARTS (ECONOMICS)', 'CHUKA UNIVERSITY': 'BACHELOR OF ARTS (ECONOMICS & SOCIOLOGY)', 'CATHOLIC UNIVERSITY OF EAST AFRICA': 'BACHELOR OF ARTS IN ECONOMICS', 'GARISSA UNIVERSITY': 'BACHELOR OF ARTS IN ECONOMICS', 'KAIMOSI FRIENDS UNIVERSITY COLLEGE': 'BACHELOR OF SCIENCE IN ECONOMICS', 'KARATINA UNIVERSITY': 'BACHELOR OF ECONOMICS', 'KCA UNIVERSITY': 'BACHELOR OF ARTS IN ECONOMICS AND BUSINESS STUDIES', 'KISII UNIVERSITY': 'BACHELOR OF ARTS (ECONOMICS AND SOCIOLOGY)', 'KIRINYAGA UNIVERSITY': 'BACHELOR OF ECONOMICS', 'LAIKIPIA UNIVERSITY': 'BACHELOR OF SCIENCE (ECONOMICS AND STATISTICS)', 'MACHAKOS UNIVERSITY': 'BACHELOR OF ECONOMICS', 'MAASAI MARA UNIVERSITY': 'BACHELOR OF SCIENCE IN ECONOMICS', 'MASENO UNIVERSITY': 'BACHELOR OF ARTS (ECONOMICS, WITH IT)', 'MERU UNIVERSITY OF SCIENCE AND TECHNOLOGY': 'BACHELOR OF SCIENCE IN ECONOMICS', 'PWANI UNIVERSITY': 'BACHELOR OF ARTS (ECONOMICS)', 'RONGO UNIVERSITY': 'BACHELOR OF ARTS (ECONOMICS)', 'SOUTH EASTERN KENYA UNIVERSITY': 'BACHELOR OF ECONOMICS AND STATISTICS', 'THARAKA UNIVERSITY COLLEGE': 'BACHELOR OF SCIENCE (ECONOMICS AND STATISTICS)', 'TOM MBOYA UNIVERSITY COLLEGE': 'BACHELOR OF ARTS (ECONOMICS, WITH IT)', 'TURKANA UNIVERSITY COLLEGE': 'BACHELOR OF SCIENCE IN ECONOMICS', 'TAITA TAVETA UNIVERSITY': 'BACHELOR OF ECONOMICS', 'UNIVERSITY OF ELDORET': 'BACHELOR OF ARTS (ECONOMICS)', 'UNIVERSITY OF EMBU': 'BACHELOR OF ECONOMICS', 'UNIVERSITY OF KABIANGA': 'BACHELOR OF ARTS (ECONOMICS)', 'ZETECH UNIVERSITY': 'BACHELOR OF ECONOMICS AND STATISTICS'}"
BACHELOR OF SCIENCE (ECONOMICS AND STATISTICS),"{'Cluster Subject 1': 'MAT A', 'Cluster Subject 2': 'BIO', 'Cluster Subject 3': 'HAG', 'Cluster Subject 4': 'BIO'}",{'Subject 1': {'MAT A': 'C+'}},"{'ALUPE UNIVERSITY COLLEGE': 'BACHELOR OF ARTS (ECONOMICS)', 'UNIVERSITY OF EASTERN AFRICA, BARATON': 'BACHELOR OF BUSINESS ADMINISTRATION IN FINANCE', 'BOMET UNIVERSITY COLLEGE': 'BACHELOR OF ARTS (ECONOMICS)', 'CHUKA UNIVERSITY': 'BACHELOR OF ARTS (ECONOMICS & SOCIOLOGY)', 'CATHOLIC UNIVERSITY OF EAST AFRICA': 'BACHELOR OF ARTS IN ECONOMICS', 'GARISSA UNIVERSITY': 'BACHELOR OF ARTS IN ECONOMICS', 'KAIMOSI FRIENDS UNIVERSITY COLLEGE': 'BACHELOR OF SCIENCE IN ECONOMICS', 'KARATINA UNIVERSITY': 'BACHELOR OF ECONOMICS', 'KCA UNIVERSITY': 'BACHELOR OF ARTS IN ECONOMICS AND BUSINESS STUDIES', 'KISII UNIVERSITY': 'BACHELOR OF ARTS (ECONOMICS AND SOCIOLOGY)', 'KIRINYAGA UNIVERSITY': 'BACHELOR OF SCIENCE (FINANCIAL ENGINEERING)', 'LAIKIPIA UNIVERSITY': 'BACHELOR OF ARTS (ECONOMICS AND SOCIOLOGY)', 'MACHAKOS UNIVERSITY': 'BACHELOR OF ECONOMICS', 'MAASAI MARA UNIVERSITY': 'BACHELOR OF SCIENCE IN FINANCIAL ECONOMICS', 'MASENO UNIVERSITY': 'BACHELOR OF ARTS (ECONOMICS, WITH IT)', 'MERU UNIVERSITY OF SCIENCE AND TECHNOLOGY': 'BACHELOR OF SCIENCE IN ECONOMICS', 'PWANI UNIVERSITY': 'BACHELOR OF ARTS (ECONOMICS)', 'RONGO UNIVERSITY': 'BACHELOR OF ARTS (ECONOMICS)', 'SOUTH EASTERN KENYA UNIVERSITY': 'BACHELOR OF ECONOMICS AND STATISTICS', 'THARAKA UNIVERSITY COLLEGE': 'BACHELOR OF SCIENCE (ECONOMICS AND STATISTICS)', 'TOM MBOYA UNIVERSITY COLLEGE': 'BACHELOR OF ARTS (ECONOMICS, WITH IT)', 'TURKANA UNIVERSITY COLLEGE': 'BACHELOR OF SCIENCE IN ECONOMICS', 'TAITA TAVETA UNIVERSITY': 'BACHELOR OF ECONOMICS', 'UNIVERSITY OF ELDORET': 'BACHELOR OF ARTS (ECONOMICS)', 'UNIVERSITY OF EMBU': 'BACHELOR OF ECONOMICS AND FINANCE', 'UNIVERSITY OF KABIANGA': 'BACHELOR OF ARTS (ECONOMICS)', 'ZETECH UNIVERSITY': 'BACHELOR OF ECONOMICS AND STATISTICS'}"
BACHELOR OF SCIENCE (MATHEMATICS WITH  IT),"{'Cluster Subject 1': 'MAT A', 'Cluster Subject 2': 'BIO', 'Cluster Subject 3': 'HAG', 'Cluster Subject 4': 'BIO'}",{'Subject 1': {'MAT A': 'C+'}},"{'UNIVERSITY OF EASTERN AFRICA, BARATON': 'BACHELOR OF SCIENCE IN MATHEMATICS', 'CATHOLIC UNIVERSITY OF EAST AFRICA': 'BACHELOR OF SCIENCE (MATHEMATICS)', 'KAIMOSI FRIENDS UNIVERSITY COLLEGE': 'BACHELOR OF SCIENCE (MATHEMATICS WITH  IT)', 'KIBABII UNIVERSITY': 'BACHELOR OF SCIENCE (MATHEMATICS)', 'KIRIRI WOMENS UNIVERSITY OF SCIENCE AND TECHNOLOGY': 'BACHELOR OF SCIENCE IN MATHEMATICS', 'MERU UNIVERSITY OF SCIENCE AND TECHNOLOGY': 'BACHELOR OF SCIENCE IN MATHEMATICS', 'RONGO UNIVERSITY': 'BACHELOR OF SCIENCE (MATHEMATICS)', 'SOUTH EASTERN KENYA UNIVERSITY': 'BACHELOR OF SCIENCE (MATHEMATICS)', 'TOM MBOYA UNIVERSITY COLLEGE': 'BACHELOR OF SCIENCE (MATHEMATICAL SCIENCES, WITH IT)'}"
BACHELOR OF SCIENCE DATA SCIENCE,"{'Cluster Subject 1': 'MAT A', 'Cluster Subject 2': 'BIO', 'Cluster Subject 3': 'HAG', 'Cluster Subject 4': 'BIO'}",{'Subject 1': {'MAT A': 'C+'}},"{'UNIVERSITY OF EASTERN AFRICA, BARATON': 'BACHELOR OF SCIENCE IN MATHEMATICS', 'CATHOLIC UNIVERSITY OF EAST AFRICA': 'BACHELOR OF SCIENCE (MATHEMATICS)', 'KAIMOSI FRIENDS UNIVERSITY COLLEGE': 'BACHELOR OF SCIENCE (MATHEMATICS WITH  IT)', 'KIBABII UNIVERSITY': 'BACHELOR OF SCIENCE (MATHEMATICS)', 'KIRIRI WOMENS UNIVERSITY OF SCIENCE AND TECHNOLOGY': 'BACHELOR OF SCIENCE IN MATHEMATICS', 'MERU UNIVERSITY OF SCIENCE AND TECHNOLOGY': 'BACHELOR OF SCIENCE IN MATHEMATICS', 'RONGO UNIVERSITY': 'BACHELOR OF SCIENCE (MATHEMATICS)', 'SOUTH EASTERN KENYA UNIVERSITY': 'BACHELOR OF SCIENCE (MATHEMATICS)', 'TOM MBOYA UNIVERSITY COLLEGE': 'BACHELOR OF SCIENCE (MATHEMATICAL SCIENCES, WITH IT)'}"
BACHELOR OF SCIENCE (OPERATIONS RESEARCH),"{'Cluster Subject 1': 'MAT A', 'Cluster Subject 2': 'BIO', 'Cluster Subject 3': 'HAG', 'Cluster Subject 4': 'BIO'}",{'Subject 1': {'MAT A': 'C+'}},{'JOMO KENYATTA UNIVERSITY OF AGRICULTURE AND TECHNOLOGY': 'BACHELOR OF SCIENCE (OPERATIONS RESEARCH)'}
BACHELOR OF SCIENCE (FINANCIAL ENGINEERING),"{'Cluster Subject 1': 'MAT A', 'Cluster Subject 2': 'BIO', 'Cluster Subject 3': 'HAG', 'Cluster Subject 4': 'BIO'}",{'Subject 1': {'MAT A': 'C+'}},"{'ALUPE UNIVERSITY COLLEGE': 'BACHELOR OF ARTS (ECONOMICS)', 'UNIVERSITY OF EASTERN AFRICA, BARATON': 'BACHELOR OF BUSINESS ADMINISTRATION IN FINANCE', 'BOMET UNIVERSITY COLLEGE': 'BACHELOR OF ARTS (ECONOMICS)', 'CHUKA UNIVERSITY': 'BACHELOR OF ARTS (ECONOMICS & SOCIOLOGY)', 'CATHOLIC UNIVERSITY OF EAST AFRICA': 'BACHELOR OF ARTS IN ECONOMICS', 'GARISSA UNIVERSITY': 'BACHELOR OF ARTS IN ECONOMICS', 'KAIMOSI FRIENDS UNIVERSITY COLLEGE': 'BACHELOR OF SCIENCE IN ECONOMICS', 'KARATINA UNIVERSITY': 'BACHELOR OF ECONOMICS', 'KCA UNIVERSITY': 'BACHELOR OF ARTS IN ECONOMICS AND BUSINESS STUDIES', 'KISII UNIVERSITY': 'BACHELOR OF ECONOMICS AND STATISTICS', 'KIRINYAGA UNIVERSITY': 'BACHELOR OF ECONOMICS & STATISTICS', 'LAIKIPIA UNIVERSITY': 'BACHELOR OF ARTS (ECONOMICS AND SOCIOLOGY)', 'MACHAKOS UNIVERSITY': 'BACHELOR OF ECONOMICS', 'MAASAI MARA UNIVERSITY': 'BACHELOR OF SCIENCE (ECONOMICS & STATISTICS)', 'MASENO UNIVERSITY': 'BACHELOR OF ARTS (ECONOMICS, WITH IT)', 'MERU UNIVERSITY OF SCIENCE AND TECHNOLOGY': 'BACHELOR OF SCIENCE IN ECONOMICS', 'PWANI UNIVERSITY': 'BACHELOR OF ARTS (ECONOMICS)', 'RONGO UNIVERSITY': 'BACHELOR OF ARTS (ECONOMICS)', 'SOUTH EASTERN KENYA UNIVERSITY': 'BACHELOR OF ECONOMICS', 'THARAKA UNIVERSITY COLLEGE': 'BACHELOR OF SCIENCE (ECONOMICS AND STATISTICS)', 'TOM MBOYA UNIVERSITY COLLEGE': 'BACHELOR OF ARTS (ECONOMICS, WITH IT)', 'TURKANA UNIVERSITY COLLEGE': 'BACHELOR OF SCIENCE IN ECONOMICS', 'TAITA TAVETA UNIVERSITY': 'BACHELOR OF ECONOMICS', 'UNIVERSITY OF ELDORET': 'BACHELOR OF ARTS (ECONOMICS)', 'UNIVERSITY OF EMBU': 'BACHELOR OF ECONOMICS AND STATISTICS', 'UNIVERSITY OF KABIANGA': 'BACHELOR OF ARTS (ECONOMICS)', 'ZETECH UNIVERSITY': 'BACHELOR OF ECONOMICS AND STATISTICS'}"
BACHELOR OF SCIENCE IN FINANCE,"{'Cluster Subject 1': 'MAT A', 'Cluster Subject 2': 'BIO', 'Cluster Subject 3': 'HAG', 'Cluster Subject 4': 'BIO'}",{'Subject 1': {'MAT A': 'C+'}},"{'CO-OPERATIVE UNIVERSITY OF KENYA': 'BACHELOR OF SCIENCE (FINANCE)', 'MOUNT KENYA UNIVERSITY': 'BACHELOR OF SCIENCE IN FINANCE AND STATISTICS', 'MERU UNIVERSITY OF SCIENCE AND TECHNOLOGY': 'BACHELOR OF SCIENCE IN FINANCE', 'UNIVERSITY OF EMBU': 'BACHELOR OF SCIENCE (FINANCE)'}"
BACHELOR OF SCIENCE (FINANCE),"{'Cluster Subject 1': 'MAT A', 'Cluster Subject 2': 'BIO', 'Cluster Subject 3': 'HAG', 'Cluster Subject 4': 'BIO'}",{'Subject 1': {'MAT A': 'C+'}},"{'CO-OPERATIVE UNIVERSITY OF KENYA': 'BACHELOR OF SCIENCE (FINANCE)', 'MOUNT KENYA UNIVERSITY': 'BACHELOR OF SCIENCE IN FINANCE AND STATISTICS', 'MERU UNIVERSITY OF SCIENCE AND TECHNOLOGY': 'BACHELOR OF SCIENCE IN FINANCE', 'UNIVERSITY OF EMBU': 'BACHELOR OF SCIENCE (FINANCE)'}"
BACHELOR OF SCIENCE IN MATHEMATICS AND FINANCE,"{'Cluster Subject 1': 'MAT A', 'Cluster Subject 2': 'BIO', 'Cluster Subject 3': 'HAG', 'Cluster Subject 4': 'BIO'}",{'Subject 1': {'MAT A': 'C+'}},{'TECHNICAL UNIVERSITY OF MOMBASA': 'BACHELOR OF SCIENCE IN MATHEMATICS AND FINANCE'}
BACHELOR OF SCIENCE (MATHEMATICS AND ECONOMICS),"{'Cluster Subject 1': 'MAT A', 'Cluster Subject 2': 'BIO', 'Cluster Subject 3': 'HAG', 'Cluster Subject 4': 'BIO'}",{'Subject 1': {'MAT A': 'C+'}},"{'CHUKA UNIVERSITY': 'BACHELOR OF ARTS IN MATHEMATICS AND ECONOMICS', 'KABARAK UNIVERSITY': 'BACHELOR OF SCIENCE IN ECONOMICS AND MATHEMATICS', 'KAIMOSI FRIENDS UNIVERSITY COLLEGE': 'BACHELOR OF SCIENCE (MATHEMATICS & ECONOMICS, WITH IT', 'KIRINYAGA UNIVERSITY': 'BACHELOR OF SCIENCE (MATHEMATICS AND ECONOMICS)', 'MASINDE MULIRO UNIVERSITY OF SCIENCE & TECHNOLOGY': 'BACHELOR OF SCIENCE (MATHEMATICS & ECONOMICS, WITH IT', 'MURANGA UNIVERSITY OF TECHNOLOGY': 'BACHELOR OF SCIENCE (MATHEMATICS AND ECONOMICS)', 'TOM MBOYA UNIVERSITY COLLEGE': 'BACHELOR OF SCIENCE (MATHEMATICS & ECONOMICS, WITH IT'}"
BACHELOR OF SCIENCE IN ECONOMICS AND MATHEMATICS,"{'Cluster Subject 1': 'MAT A', 'Cluster Subject 2': 'BIO', 'Cluster Subject 3': 'HAG', 'Cluster Subject 4': 'BIO'}",{'Subject 1': {'MAT A': 'C+'}},"{'CHUKA UNIVERSITY': 'BACHELOR OF ARTS IN MATHEMATICS AND ECONOMICS', 'KABARAK UNIVERSITY': 'BACHELOR OF SCIENCE IN ECONOMICS AND MATHEMATICS', 'KAIMOSI FRIENDS UNIVERSITY COLLEGE': 'BACHELOR OF SCIENCE (MATHEMATICS & ECONOMICS, WITH IT', 'KIRINYAGA UNIVERSITY': 'BACHELOR OF SCIENCE (MATHEMATICS AND ECONOMICS)', 'MASINDE MULIRO UNIVERSITY OF SCIENCE & TECHNOLOGY': 'BACHELOR OF SCIENCE (MATHEMATICS & ECONOMICS, WITH IT', 'MURANGA UNIVERSITY OF TECHNOLOGY': 'BACHELOR OF SCIENCE (MATHEMATICS AND ECONOMICS)', 'TOM MBOYA UNIVERSITY COLLEGE': 'BACHELOR OF SCIENCE (MATHEMATICS & ECONOMICS, WITH IT'}"
BACHELOR OF BUSINESS ADMINISTRATION IN FINANCE,"{'Cluster Subject 1': 'MAT A', 'Cluster Subject 2': 'BIO', 'Cluster Subject 3': 'HAG', 'Cluster Subject 4': 'BIO'}",{'Subject 1': {'MAT A': 'C+'}},"{'ALUPE UNIVERSITY COLLEGE': 'BACHELOR OF ARTS (ECONOMICS)', 'UNIVERSITY OF EASTERN AFRICA, BARATON': 'BACHELOR OF BUSINESS ADMINISTRATION IN FINANCE', 'BOMET UNIVERSITY COLLEGE': 'BACHELOR OF ARTS (ECONOMICS)', 'CHUKA UNIVERSITY': 'BACHELOR OF ARTS (ECONOMICS & SOCIOLOGY)', 'CATHOLIC UNIVERSITY OF EAST AFRICA': 'BACHELOR OF ARTS IN ECONOMICS', 'GARISSA UNIVERSITY': 'BACHELOR OF ARTS IN ECONOMICS', 'KAIMOSI FRIENDS UNIVERSITY COLLEGE': 'BACHELOR OF SCIENCE IN ECONOMICS', 'KARATINA UNIVERSITY': 'BACHELOR OF ECONOMICS', 'KCA UNIVERSITY': 'BACHELOR OF ARTS IN ECONOMICS AND BUSINESS STUDIES', 'KISII UNIVERSITY': 'BACHELOR OF ARTS (ECONOMICS AND SOCIOLOGY)', 'KIRINYAGA UNIVERSITY': 'BACHELOR OF ECONOMICS', 'LAIKIPIA UNIVERSITY': 'BACHELOR OF SCIENCE (ECONOMICS AND STATISTICS)', 'MACHAKOS UNIVERSITY': 'BACHELOR OF ECONOMICS', 'MAASAI MARA UNIVERSITY': 'BACHELOR OF SCIENCE IN ECONOMICS', 'MASENO UNIVERSITY': 'BACHELOR OF ARTS (ECONOMICS, WITH IT)', 'MERU UNIVERSITY OF SCIENCE AND TECHNOLOGY': 'BACHELOR OF SCIENCE IN ECONOMICS', 'PWANI UNIVERSITY': 'BACHELOR OF ARTS (ECONOMICS)', 'RONGO UNIVERSITY': 'BACHELOR OF ARTS (ECONOMICS)', 'SOUTH EASTERN KENYA UNIVERSITY': 'BACHELOR OF ECONOMICS AND STATISTICS', 'THARAKA UNIVERSITY COLLEGE': 'BACHELOR OF SCIENCE (ECONOMICS AND STATISTICS)', 'TOM MBOYA UNIVERSITY COLLEGE': 'BACHELOR OF ARTS (ECONOMICS, WITH IT)', 'TURKANA UNIVERSITY COLLEGE': 'BACHELOR OF SCIENCE IN ECONOMICS', 'TAITA TAVETA UNIVERSITY': 'BACHELOR OF ECONOMICS', 'UNIVERSITY OF ELDORET': 'BACHELOR OF ARTS (ECONOMICS)', 'UNIVERSITY OF EMBU': 'BACHELOR OF ECONOMICS', 'UNIVERSITY OF KABIANGA': 'BACHELOR OF ARTS (ECONOMICS)', 'ZETECH UNIVERSITY': 'BACHELOR OF ECONOMICS AND STATISTICS'}"
"BACHELOR OF SCIENCE (MATHEMATICS & ECONOMICS, WITH IT","{'Cluster Subject 1': 'MAT A', 'Cluster Subject 2': 'BIO', 'Cluster Subject 3': 'HAG', 'Cluster Subject 4': 'BIO'}",{'Subject 1': {'MAT A': 'C+'}},"{'CHUKA UNIVERSITY': 'BACHELOR OF ARTS IN MATHEMATICS AND ECONOMICS', 'KABARAK UNIVERSITY': 'BACHELOR OF SCIENCE IN ECONOMICS AND MATHEMATICS', 'KAIMOSI FRIENDS UNIVERSITY COLLEGE': 'BACHELOR OF SCIENCE (MATHEMATICS & ECONOMICS, WITH IT', 'KIRINYAGA UNIVERSITY': 'BACHELOR OF SCIENCE (MATHEMATICS AND ECONOMICS)', 'MASINDE MULIRO UNIVERSITY OF SCIENCE & TECHNOLOGY': 'BACHELOR OF SCIENCE (MATHEMATICS & ECONOMICS, WITH IT', 'MURANGA UNIVERSITY OF TECHNOLOGY': 'BACHELOR OF SCIENCE (MATHEMATICS AND ECONOMICS)', 'TOM MBOYA UNIVERSITY COLLEGE': 'BACHELOR OF SCIENCE (MATHEMATICS & ECONOMICS, WITH IT'}"
BACHELOR OF ARTS IN MATHEMATICS AND ECONOMICS,"{'Cluster Subject 1': 'MAT A', 'Cluster Subject 2': 'BIO', 'Cluster Subject 3': 'HAG', 'Cluster Subject 4': 'BIO'}",{'Subject 1': {'MAT A': 'C+'}},"{'CHUKA UNIVERSITY': 'BACHELOR OF ARTS IN MATHEMATICS AND ECONOMICS', 'KABARAK UNIVERSITY': 'BACHELOR OF SCIENCE IN ECONOMICS AND MATHEMATICS', 'KAIMOSI FRIENDS UNIVERSITY COLLEGE': 'BACHELOR OF SCIENCE (MATHEMATICS & ECONOMICS, WITH IT', 'KIRINYAGA UNIVERSITY': 'BACHELOR OF SCIENCE (MATHEMATICS AND ECONOMICS)', 'MASINDE MULIRO UNIVERSITY OF SCIENCE & TECHNOLOGY': 'BACHELOR OF SCIENCE (MATHEMATICS & ECONOMICS, WITH IT', 'MURANGA UNIVERSITY OF TECHNOLOGY': 'BACHELOR OF SCIENCE (MATHEMATICS AND ECONOMICS)', 'TOM MBOYA UNIVERSITY COLLEGE': 'BACHELOR OF SCIENCE (MATHEMATICS & ECONOMICS, WITH IT'}"
BACHELOR OF ECONOMICS & FINANCE,"{'Cluster Subject 1': 'MAT A', 'Cluster Subject 2': 'BIO', 'Cluster Subject 3': 'HAG', 'Cluster Subject 4': 'BIO'}",{'Subject 1': {'MAT A': 'C+'}},"{'ALUPE UNIVERSITY COLLEGE': 'BACHELOR OF ARTS (ECONOMICS)', 'UNIVERSITY OF EASTERN AFRICA, BARATON': 'BACHELOR OF BUSINESS ADMINISTRATION IN FINANCE', 'BOMET UNIVERSITY COLLEGE': 'BACHELOR OF ARTS (ECONOMICS)', 'CHUKA UNIVERSITY': 'BACHELOR OF ARTS (ECONOMICS & SOCIOLOGY)', 'CATHOLIC UNIVERSITY OF EAST AFRICA': 'BACHELOR OF ARTS IN ECONOMICS', 'GARISSA UNIVERSITY': 'BACHELOR OF ARTS IN ECONOMICS', 'KAIMOSI FRIENDS UNIVERSITY COLLEGE': 'BACHELOR OF SCIENCE IN ECONOMICS', 'KARATINA UNIVERSITY': 'BACHELOR OF ECONOMICS', 'KCA UNIVERSITY': 'BACHELOR OF ARTS IN ECONOMICS AND BUSINESS STUDIES', 'KISII UNIVERSITY': 'BACHELOR OF ECONOMICS AND STATISTICS', 'KIRINYAGA UNIVERSITY': 'BACHELOR OF ECONOMICS & STATISTICS', 'LAIKIPIA UNIVERSITY': 'BACHELOR OF SCIENCE (ECONOMICS AND STATISTICS)', 'MACHAKOS UNIVERSITY': 'BACHELOR OF ECONOMICS', 'MAASAI MARA UNIVERSITY': 'BACHELOR OF SCIENCE (ECONOMICS & STATISTICS)', 'MASENO UNIVERSITY': 'BACHELOR OF ARTS (ECONOMICS, WITH IT)', 'MERU UNIVERSITY OF SCIENCE AND TECHNOLOGY': 'BACHELOR OF SCIENCE IN ECONOMICS', 'PWANI UNIVERSITY': 'BACHELOR OF ARTS (ECONOMICS)', 'RONGO UNIVERSITY': 'BACHELOR OF ARTS (ECONOMICS)', 'SOUTH EASTERN KENYA UNIVERSITY': 'BACHELOR OF ECONOMICS', 'THARAKA UNIVERSITY COLLEGE': 'BACHELOR OF SCIENCE (ECONOMICS AND STATISTICS)', 'TOM MBOYA UNIVERSITY COLLEGE': 'BACHELOR OF ARTS (ECONOMICS, WITH IT)', 'TURKANA UNIVERSITY COLLEGE': 'BACHELOR OF SCIENCE IN ECONOMICS', 'TAITA TAVETA UNIVERSITY': 'BACHELOR OF ECONOMICS', 'UNIVERSITY OF ELDORET': 'BACHELOR OF ARTS (ECONOMICS)', 'UNIVERSITY OF EMBU': 'BACHELOR OF ECONOMICS AND STATISTICS', 'UNIVERSITY OF KABIANGA': 'BACHELOR OF ARTS (ECONOMICS)', 'ZETECH UNIVERSITY': 'BACHELOR OF ECONOMICS AND STATISTICS'}"
BACHELOR OF ECONOMICS AND FINANCE,"{'Cluster Subject 1': 'MAT A', 'Cluster Subject 2': 'BIO', 'Cluster Subject 3': 'HAG', 'Cluster Subject 4': 'BIO'}",{'Subject 1': {'MAT A': 'C+'}},"{'ALUPE UNIVERSITY COLLEGE': 'BACHELOR OF ARTS (ECONOMICS)', 'UNIVERSITY OF EASTERN AFRICA, BARATON': 'BACHELOR OF BUSINESS ADMINISTRATION IN FINANCE', 'BOMET UNIVERSITY COLLEGE': 'BACHELOR OF ARTS (ECONOMICS)', 'CHUKA UNIVERSITY': 'BACHELOR OF ARTS (ECONOMICS & SOCIOLOGY)', 'CATHOLIC UNIVERSITY OF EAST AFRICA': 'BACHELOR OF ARTS IN ECONOMICS', 'GARISSA UNIVERSITY': 'BACHELOR OF ARTS IN ECONOMICS', 'KAIMOSI FRIENDS UNIVERSITY COLLEGE': 'BACHELOR OF SCIENCE IN ECONOMICS', 'KARATINA UNIVERSITY': 'BACHELOR OF ECONOMICS', 'KCA UNIVERSITY': 'BACHELOR OF ARTS IN ECONOMICS AND BUSINESS STUDIES', 'KISII UNIVERSITY': 'BACHELOR OF ECONOMICS AND STATISTICS', 'KIRINYAGA UNIVERSITY': 'BACHELOR OF ECONOMICS', 'LAIKIPIA UNIVERSITY': 'BACHELOR OF SCIENCE (ECONOMICS AND STATISTICS)', 'MACHAKOS UNIVERSITY': 'BACHELOR OF ECONOMICS', 'MAASAI MARA UNIVERSITY': 'BACHELOR OF SCIENCE IN ECONOMICS', 'MASENO UNIVERSITY': 'BACHELOR OF ARTS (ECONOMICS, WITH IT)', 'MERU UNIVERSITY OF SCIENCE AND TECHNOLOGY': 'BACHELOR OF SCIENCE IN ECONOMICS', 'PWANI UNIVERSITY': 'BACHELOR OF ARTS (ECONOMICS)', 'RONGO UNIVERSITY': 'BACHELOR OF ARTS (ECONOMICS)', 'SOUTH EASTERN KENYA UNIVERSITY': 'BACHELOR OF ECONOMICS AND STATISTICS', 'THARAKA UNIVERSITY COLLEGE': 'BACHELOR OF SCIENCE (ECONOMICS AND STATISTICS)', 'TOM MBOYA UNIVERSITY COLLEGE': 'BACHELOR OF ARTS (ECONOMICS, WITH IT)', 'TURKANA UNIVERSITY COLLEGE': 'BACHELOR OF SCIENCE IN ECONOMICS', 'TAITA TAVETA UNIVERSITY': 'BACHELOR OF ECONOMICS', 'UNIVERSITY OF ELDORET': 'BACHELOR OF ARTS (ECONOMICS)', 'UNIVERSITY OF EMBU': 'BACHELOR OF ECONOMICS', 'UNIVERSITY OF KABIANGA': 'BACHELOR OF ARTS (ECONOMICS)', 'ZETECH UNIVERSITY': 'BACHELOR OF ECONOMICS AND STATISTICS'}"
"BACHELOR OF SCIENCE (MATHEMATICS & BUSINESS STUDIES, WITH IT)","{'Cluster Subject 1': 'MAT A', 'Cluster Subject 2': 'BIO', 'Cluster Subject 3': 'HAG', 'Cluster Subject 4': 'BIO'}",{'Subject 1': {'MAT A': 'C+'}},"{'MASENO UNIVERSITY': 'BACHELOR OF SCIENCE (MATHEMATICS & BUSINESS STUDIES, WITH IT)', 'TOM MBOYA UNIVERSITY COLLEGE': 'BACHELOR OF SCIENCE (MATHEMATICS & BUSINESS STUDIES, WITH IT)'}"
BACHELOR OF BUSINESS ADMINISTRATION IN ACCOUNTING,"{'Cluster Subject 1': 'MAT A', 'Cluster Subject 2': 'BIO', 'Cluster Subject 3': 'HAG', 'Cluster Subject 4': 'BIO'}","{'Subject 1': {'MAT A': 'C+'}, 'Subject 2': {'ENG': 'C+'}}","{'UNIVERSITY OF EASTERN AFRICA, BARATON': 'BACHELOR OF BUSINESS ADMINISTRATION IN ACCOUNTING'}"
BACHELOR OF SCIENCE IN FINANCE AND STATISTICS,"{'Cluster Subject 1': 'MAT A', 'Cluster Subject 2': 'BIO', 'Cluster Subject 3': 'HAG', 'Cluster Subject 4': 'BIO'}",{'Subject 1': {'MAT A': 'C+'}},"{'CO-OPERATIVE UNIVERSITY OF KENYA': 'BACHELOR OF SCIENCE (FINANCE)', 'MOUNT KENYA UNIVERSITY': 'BACHELOR OF SCIENCE IN FINANCE AND STATISTICS', 'MERU UNIVERSITY OF SCIENCE AND TECHNOLOGY': 'BACHELOR OF SCIENCE IN FINANCE', 'UNIVERSITY OF EMBU': 'BACHELOR OF SCIENCE (FINANCE)'}"
BACHELOR OF ARTS (ECONOMICS),"{'Cluster Subject 1': 'MAT A', 'Cluster Subject 2': 'BIO', 'Cluster Subject 3': 'HAG', 'Cluster Subject 4': 'BIO'}",{'Subject 1': {'MAT A': 'C+'}},"{'ALUPE UNIVERSITY COLLEGE': 'BACHELOR OF ARTS (ECONOMICS)', 'UNIVERSITY OF EASTERN AFRICA, BARATON': 'BACHELOR OF BUSINESS ADMINISTRATION IN FINANCE', 'BOMET UNIVERSITY COLLEGE': 'BACHELOR OF ARTS (ECONOMICS)', 'CHUKA UNIVERSITY': 'BACHELOR OF ARTS (ECONOMICS & SOCIOLOGY)', 'CATHOLIC UNIVERSITY OF EAST AFRICA': 'BACHELOR OF ARTS IN ECONOMICS', 'GARISSA UNIVERSITY': 'BACHELOR OF ARTS IN ECONOMICS', 'KAIMOSI FRIENDS UNIVERSITY COLLEGE': 'BACHELOR OF SCIENCE IN ECONOMICS', 'KARATINA UNIVERSITY': 'BACHELOR OF ECONOMICS', 'KCA UNIVERSITY': 'BACHELOR OF ARTS IN ECONOMICS AND BUSINESS STUDIES', 'KISII UNIVERSITY': 'BACHELOR OF ECONOMICS AND STATISTICS', 'KIRINYAGA UNIVERSITY': 'BACHELOR OF ECONOMICS', 'LAIKIPIA UNIVERSITY': 'BACHELOR OF SCIENCE (ECONOMICS AND STATISTICS)', 'MACHAKOS UNIVERSITY': 'BACHELOR OF ECONOMICS', 'MAASAI MARA UNIVERSITY': 'BACHELOR OF SCIENCE IN ECONOMICS', 'MASENO UNIVERSITY': 'BACHELOR OF ARTS (ECONOMICS, WITH IT)', 'MERU UNIVERSITY OF SCIENCE AND TECHNOLOGY': 'BACHELOR OF SCIENCE IN ECONOMICS', 'PWANI UNIVERSITY': 'BACHELOR OF ARTS (ECONOMICS)', 'RONGO UNIVERSITY': 'BACHELOR OF ARTS (ECONOMICS)', 'SOUTH EASTERN KENYA UNIVERSITY': 'BACHELOR OF ECONOMICS AND STATISTICS', 'THARAKA UNIVERSITY COLLEGE': 'BACHELOR OF SCIENCE (ECONOMICS AND STATISTICS)', 'TOM MBOYA UNIVERSITY COLLEGE': 'BACHELOR OF ARTS (ECONOMICS, WITH IT)', 'TURKANA UNIVERSITY COLLEGE': 'BACHELOR OF SCIENCE IN ECONOMICS', 'TAITA TAVETA UNIVERSITY': 'BACHELOR OF ECONOMICS', 'UNIVERSITY OF ELDORET': 'BACHELOR OF ARTS (ECONOMICS)', 'UNIVERSITY OF EMBU': 'BACHELOR OF ECONOMICS', 'UNIVERSITY OF KABIANGA': 'BACHELOR OF ARTS (ECONOMICS)', 'ZETECH UNIVERSITY': 'BACHELOR OF ECONOMICS AND STATISTICS'}"
