Cluster Subject 1,Cluster Subject 2,Cluster Subject 3,Cluster Subject 4,KIRINYAGA UNIVERSITY,MAT A,PHY,degree
MAT A,PHY,HAG,BIO,"BACHELOR OF TECHNICAL EDUCATION (BUILDING CONSTRUCTION OPTION, MECHANICAL ENGINEERING OPTION, ELECTRICAL AND ELECTRONIC OPTION) )",C+,C+,"BACHELOR OF TECHNICAL EDUCATION (BUILDING CONSTRUCTION OPTION, MECHANICAL ENGINEERING OPTION, ELECTRICAL AND ELECTRONIC OPTION) )"
MAT A,PHY,BIO,BIO,C,C+,C+,BACHELOR OF SCIENCE IN GEOINFORMATICS,BACHELOR OF SCIENCE IN GEOINFORMATICS
C,MAT A,PHY,BIO,BIO,BACHELOR OF SCIENCE (GEOPHYSICS AND MINERALOGY),C+,C+,BACHELOR OF SCIENCE (GEOPHYSICS AND MINERALOGY)
C,MAT A,PHY,BIO,BIO,C+,C+,BACHELOR OF SCIENCE (GEOLOGY),BACHELOR OF SCIENCE (GEOLOGY)
C,MAT A,PHY,BIO,BIO,BACHELOR OF SCIENCE (DISASTER MITIGATION AND SUSTAINABLE DEVELOPMENT),C,C,BACHELOR OF SCIENCE (DISASTER MITIGATION AND SUSTAINABLE DEVELOPMENT)
MAT A,PHY,HAG,BIO,BACHELOR OF ARTS(SPATIAL PLANNING),C,BACHELOR OF ARTS(SPATIAL PLANNING)
C,MAT A,PHY,BIO,BIO,C+,C+,BACHELOR OF SCIENCE (METEOROLOGY),BACHELOR OF SCIENCE (METEOROLOGY),BACHELOR OF SCIENCE (METEOROLOGY)
C,MAT A,PHY,BIO,BIO,C+,C+,BACHELOR OF SCIENCE (HYDROLOGY AND WATER RESOURCES MANAGEMENT),BACHELOR OF SCIENCE (HYDROLOGY AND WATER RESOURCES MANAGEMENT)
C,MAT A,PHY,BIO,BIO,"BACHELOR OF SCIENCE (EARTH SCIENCE, WITH IT)",C+,C+,"BACHELOR OF SCIENCE (EARTH SCIENCE, WITH IT)","BACHELOR OF SCIENCE (EARTH SCIENCE, WITH IT)"
C,MAT A,PHY,BIO,BIO,BACHELOR OF SCIENCE (ENVIRONMENTAL EDUCATION),BACHELOR OF ENVIRONMENTAL STUDIES (EARTH SCIENCES) ,BACHELOR OF ENVIRONMENTAL STUDIES (ENVIRONMENTAL RESOURCE CONSERVATION),C+,C+,BACHELOR OF ENVIRONMENTAL STUDIES,BACHELOR OF ENVIRONMENTAL STUDIES (EARTH SCIENCES) 
BACHELOR OF SCIENCE IN INFORMATION TECHNOLOGY,MAT A,PHY,BIO,BIO,BACHELOR OF SCIENCE IN INFORMATION TECHNOLOGY,BACHELOR OF SCIENCE (INFORMATION TECHNOLOGY),C,BACHELOR OF SCIENCE IN INFORMATION TECHNOLOGY,BACHELOR OF INFORMATION COMMUNICATION TECHNOLOGY,BACHELOR OF INFORMATION TECHNOLOGY,BACHELOR OF SCIENCE (INFORMATION TECHNOLOGY),BACHELOR OF SCIENCE (INFORMATION TECHNOLOGY),BACHELOR OF INFORMATION TECHNOLOGY,BACHELOR OF SCIENCE IN INFORMATION TECHNOLOGY,BACHELOR OF INFORMATION COMMUNICATION TECHNOLOGY
MAT A,PHY,BIO,BIO,BACHELOR OF SCIENCE (COMPUTER TECHNOLOGY),C+,BACHELOR OF SCIENCE IN COMPUTER TECHNOLOGY,BACHELOR OF SCIENCE IN COMPUTER TECHNOLOGY,C+,BACHELOR OF SCIENCE (COMPUTER TECHNOLOGY)
BACHELOR OF SCIENCE (COMPUTER SCIENCE),MAT A,PHY,BIO,BIO,BACHELOR OF SCIENCE IN COMPUTER SCIENCE,BACHELOR OF SCIENCE IN COMPUTER SCIENCE,BACHELOR OF SCIENCE IN APPLIED COMPUTING,BACHELOR OF SCIENCE (COMPUTER SCIENCE),BACHELOR OF SCIENCE (COMPUTER SCIENCE),BACHELOR OF SCIENCE IN COMPUTER SCIENCE,C+,C+,BACHELOR OF SCIENCE IN COMPUTER SCIENCE,BACHELOR OF SCIENCE (COMPUTER SCIENCE),BACHELOR OF SCIENCE (COMPUTER SCIENCE),BACHELOR OF SCIENCE (APPLIED COMPUTER SCIENCE),BACHELOR OF SCIENCE (COMPUTER SCIENCE),BACHELOR OF SCIENCE IN COMPUTER SCIENCE,BACHELOR OF SCIENCE IN COMPUTER SCIENCE
BACHELOR OF SCIENCE (COMPUTER SCIENCE),MAT A,PHY,BIO,BIO,BACHELOR OF SCIENCE IN COMPUTER SCIENCE,BACHELOR OF SCIENCE IN COMPUTER SCIENCE,BACHELOR OF SCIENCE IN APPLIED COMPUTING,BACHELOR OF SCIENCE (COMPUTER SCIENCE),BACHELOR OF SCIENCE (COMPUTER SCIENCE),BACHELOR OF SCIENCE IN COMPUTER SCIENCE,C+,C+,BACHELOR OF SCIENCE IN COMPUTER SCIENCE,BACHELOR OF SCIENCE (COMPUTER SCIENCE),BACHELOR OF SCIENCE (COMPUTER SCIENCE),BACHELOR OF SCIENCE (APPLIED COMPUTER SCIENCE),BACHELOR OF SCIENCE (COMPUTER SCIENCE),BACHELOR OF SCIENCE IN COMPUTER SCIENCE,BACHELOR OF SCIENCE (COMPUTER SCIENCE)
MAT A,PHY,BIO,BIO,BACHELOR OF SCIENCE (COMPUTER TECHNOLOGY),C+,BACHELOR OF SCIENCE IN COMPUTER TECHNOLOGY,BACHELOR OF SCIENCE IN COMPUTER TECHNOLOGY,C+,BACHELOR OF SCIENCE IN COMPUTER TECHNOLOGY
BACHELOR OF SCIENCE IN INFORMATION TECHNOLOGY,MAT A,PHY,BIO,BIO,BACHELOR OF SCIENCE IN INFORMATION TECHNOLOGY,BACHELOR OF SCIENCE (INFORMATION TECHNOLOGY),C,BACHELOR OF SCIENCE IN INFORMATION TECHNOLOGY,BACHELOR OF INFORMATION COMMUNICATION TECHNOLOGY,BACHELOR OF INFORMATION TECHNOLOGY,BACHELOR OF SCIENCE (INFORMATION TECHNOLOGY),BACHELOR OF SCIENCE (INFORMATION TECHNOLOGY),BACHELOR OF INFORMATION TECHNOLOGY,BACHELOR OF SCIENCE IN INFORMATION TECHNOLOGY,BACHELOR OF INFORMATION TECHNOLOGY
BACHELOR OF SCIENCE IN INFORMATION TECHNOLOGY,MAT A,PHY,BIO,BIO,BACHELOR OF SCIENCE IN INFORMATION TECHNOLOGY,BACHELOR OF SCIENCE (INFORMATION TECHNOLOGY),C,BACHELOR OF SCIENCE IN INFORMATION TECHNOLOGY,BACHELOR OF INFORMATION COMMUNICATION TECHNOLOGY,BACHELOR OF INFORMATION TECHNOLOGY,BACHELOR OF SCIENCE (INFORMATION TECHNOLOGY),BACHELOR OF SCIENCE (INFORMATION TECHNOLOGY),BACHELOR OF INFORMATION TECHNOLOGY,BACHELOR OF SCIENCE IN INFORMATION TECHNOLOGY,BACHELOR OF SCIENCE (INFORMATION TECHNOLOGY)
MAT A,PHY,BIO,BIO,C,BACHELOR OF SCIENCE (INFORMATICS),BACHELOR OF SCIENCE (INFORMATICS)
BACHELOR OF SCIENCE IN INFORMATION TECHNOLOGY,MAT A,PHY,BIO,BIO,BACHELOR OF SCIENCE IN INFORMATION TECHNOLOGY,BACHELOR OF SCIENCE (INFORMATION TECHNOLOGY),C,BACHELOR OF SCIENCE IN INFORMATION TECHNOLOGY,BACHELOR OF INFORMATION COMMUNICATION TECHNOLOGY,BACHELOR OF INFORMATION TECHNOLOGY,BACHELOR OF SCIENCE (INFORMATION TECHNOLOGY),BACHELOR OF SCIENCE (INFORMATION TECHNOLOGY),BACHELOR OF INFORMATION TECHNOLOGY,BACHELOR OF SCIENCE IN INFORMATION TECHNOLOGY,BACHELOR OF INFORMATION TECHNOLOGY
BACHELOR OF SCIENCE IN INFORMATION TECHNOLOGY,MAT A,PHY,BIO,BIO,BACHELOR OF SCIENCE IN INFORMATION TECHNOLOGY,BACHELOR OF SCIENCE (INFORMATION TECHNOLOGY),C,BACHELOR OF SCIENCE IN INFORMATION TECHNOLOGY,BACHELOR OF INFORMATION COMMUNICATION TECHNOLOGY,BACHELOR OF INFORMATION TECHNOLOGY,BACHELOR OF SCIENCE (INFORMATION TECHNOLOGY),BACHELOR OF SCIENCE (INFORMATION TECHNOLOGY),BACHELOR OF INFORMATION TECHNOLOGY,BACHELOR OF SCIENCE IN INFORMATION TECHNOLOGY,BACHELOR OF SCIENCE IN INFORMATION TECHNOLOGY
MAT A,PHY,BIO,BIO,BACHELOR OF SCIENCE (BIOMETRY AND INFORMATICS),C,BACHELOR OF SCIENCE (BIOMETRY AND INFORMATICS)
BACHELOR OF SCIENCE (COMPUTER SCIENCE),MAT A,PHY,BIO,BIO,BACHELOR OF SCIENCE IN COMPUTER SCIENCE,BACHELOR OF SCIENCE IN COMPUTER SCIENCE,BACHELOR OF SCIENCE IN APPLIED COMPUTING,BACHELOR OF SCIENCE (COMPUTER SCIENCE),BACHELOR OF SCIENCE (COMPUTER SCIENCE),BACHELOR OF SCIENCE IN COMPUTER SCIENCE,C+,C+,BACHELOR OF SCIENCE IN COMPUTER SCIENCE,BACHELOR OF SCIENCE (COMPUTER SCIENCE),BACHELOR OF SCIENCE (COMPUTER SCIENCE),BACHELOR OF SCIENCE (COMPUTER SCIENCE),BACHELOR OF SCIENCE (COMPUTER SCIENCE),BACHELOR OF SCIENCE IN COMPUTER SCIENCE,BACHELOR OF SCIENCE IN APPLIED COMPUTING
MAT A,PHY,BIO,BIO,C+,C+,BACHELOR OF SCIENCE IN NETWORKS AND COMMUNICATION SYSTEMS ,BACHELOR OF SCIENCE IN NETWORKS AND COMMUNICATION SYSTEMS 
BACHELOR OF SCIENCE (COMPUTER SCIENCE),MAT A,PHY,BIO,BIO,BACHELOR OF SCIENCE IN COMPUTER SCIENCE,BACHELOR OF SCIENCE IN COMPUTER SCIENCE,BACHELOR OF SCIENCE IN APPLIED COMPUTING,BACHELOR OF SCIENCE (COMPUTER SCIENCE),BACHELOR OF SCIENCE (COMPUTER SCIENCE),BACHELOR OF SCIENCE IN COMPUTER SCIENCE,C+,C+,BACHELOR OF SCIENCE IN COMPUTER SCIENCE,BACHELOR OF SCIENCE (COMPUTER SCIENCE),BACHELOR OF SCIENCE (COMPUTER SCIENCE),BACHELOR OF SCIENCE (COMPUTER SCIENCE),BACHELOR OF SCIENCE (COMPUTER SCIENCE),BACHELOR OF SCIENCE IN COMPUTER SCIENCE,BACHELOR OF SCIENCE (APPLIED COMPUTER SCIENCE)
BACHELOR OF SCIENCE (PHYSICS),BACHELOR OF ENGINEERING PHYSICS,MAT A,PHY,BIO,BIO,BACHELOR OF SCIENCE (PHYSICS),BACHELOR OF SCIENCE (PHYSICS),C+,BACHELOR OF SCIENCE IN PHYSICS,C+,BACHELOR OF SCIENCE (PHYSICS),BACHELOR OF SCIENCE (PHYSICS),BACHELOR OF SCIENCE IN APPLIED PHYSICS,"BACHELOR OF SCIENCE (PHYSICS, WITH IT)",BACHELOR OF ENGINEERING PHYSICS
MAT A,PHY,BIO,BIO,BACHELOR OF SCIENCE IN INFORMATION SECURITY AND FORENSICS,C+,BACHELOR OF SCIENCE IN INFORMATION SECURITY AND FORENSICS
C,CHE,MAT A,BIO,ENG,BACHELOR OF SCIENCE (FASHION DESIGN AND TEXTILE TECHNOLOGY),BACHELOR OF SCIENCE (FASHION DESIGN AND TEXTILE TECHNOLOGY),BACHELOR OF SCIENCE IN TEXTILE TECHNOLOGY & APPLIED FASHION DESIGN,BACHELOR OF SCIENCE (FASHION DESIGN AND TEXTILE TECHNOLOGY),BACHELOR OF SCIENCE IN TEXTILE TECHNOLOGY & APPLIED FASHION DESIGN
BACHELOR OF SCIENCE (PHYSICS),BACHELOR OF ENGINEERING PHYSICS,MAT A,PHY,BIO,BIO,BACHELOR OF SCIENCE (PHYSICS),BACHELOR OF SCIENCE (PHYSICS),C+,BACHELOR OF SCIENCE IN PHYSICS,C+,BACHELOR OF SCIENCE (PHYSICS),BACHELOR OF SCIENCE (PHYSICS),BACHELOR OF SCIENCE IN APPLIED PHYSICS,"BACHELOR OF SCIENCE (PHYSICS, WITH IT)",BACHELOR OF SCIENCE IN APPLIED PHYSICS
MAT A,PHY,BIO,BIO,C+,BACHELOR OF SCIENCE IN COMPUTING AND INFORMATION SYSTEMS,BACHELOR OF SCIENCE IN COMPUTING AND INFORMATION SYSTEMS
C+,MAT A,PHY,CHE,BIO,BACHELOR OF SCIENCE (INDUSTRIAL CHEMISTRY),C,BACHELOR OF SCIENCE (INDUSTRIAL CHEMISTRY),C,BACHELOR OF SCIENCE IN INDUSTRIAL CHEMISTRY,"BACHELOR OF SCIENCE (INDUSTRIAL CHEMISTRY, WITH IT)",BACHELOR OF SCIENCE (INDUSTRIAL CHEMISTRY),BACHELOR OF SCIENCE IN INDUSTRIAL CHEMISTRY
C+,MAT A,PHY,CHE,BIO,BACHELOR OF SCIENCE IN ANALYTICAL CHEMISTRY,BACHELOR OF SCIENCE (ANALYTICAL CHEMISTRY),BACHELOR OF SCIENCE IN ANALYTICAL CHEMISTRY,C,BACHELOR OF SCIENCE (ANALYTICAL CHEMISTRY),C,BACHELOR OF SCIENCE IN ANALYTICAL CHEMISTRY,BACHELOR OF SCIENCE IN ANALYTICAL CHEMISTRY WITH COMPUTING,BACHELOR OF SCIENCE (ANALYTICAL CHEMISTRY),BACHELOR OF SCIENCE (ANALYTICAL CHEMISTRY)
C,CHE,MAT A,BIO,ENG,BACHELOR OF SCIENCE (FASHION DESIGN AND TEXTILE TECHNOLOGY),BACHELOR OF SCIENCE (FASHION DESIGN AND TEXTILE TECHNOLOGY),BACHELOR OF SCIENCE IN TEXTILE TECHNOLOGY & APPLIED FASHION DESIGN,BACHELOR OF SCIENCE (FASHION DESIGN AND TEXTILE TECHNOLOGY),BACHELOR OF SCIENCE (FASHION DESIGN AND TEXTILE TECHNOLOGY)
C+,MAT A,PHY,CHE,BIO,BACHELOR OF SCIENCE (INDUSTRIAL CHEMISTRY),C,BACHELOR OF SCIENCE (INDUSTRIAL CHEMISTRY),C,BACHELOR OF SCIENCE IN INDUSTRIAL CHEMISTRY,"BACHELOR OF SCIENCE (INDUSTRIAL CHEMISTRY, WITH IT)",BACHELOR OF SCIENCE (INDUSTRIAL CHEMISTRY),BACHELOR OF SCIENCE (INDUSTRIAL CHEMISTRY)
C+,MAT A,PHY,CHE,BIO,BACHELOR OF SCIENCE (INDUSTRIAL CHEMISTRY),C,BACHELOR OF SCIENCE (INDUSTRIAL CHEMISTRY),C,BACHELOR OF SCIENCE IN INDUSTRIAL CHEMISTRY,"BACHELOR OF SCIENCE (INDUSTRIAL CHEMISTRY, WITH IT)",BACHELOR OF SCIENCE (INDUSTRIAL CHEMISTRY),"BACHELOR OF SCIENCE (INDUSTRIAL CHEMISTRY, WITH IT)"
C+,MAT A,PHY,CHE,BIO,BACHELOR OF SCIENCE IN ANALYTICAL CHEMISTRY,BACHELOR OF SCIENCE (ANALYTICAL CHEMISTRY),BACHELOR OF SCIENCE IN ANALYTICAL CHEMISTRY,C,BACHELOR OF SCIENCE (ANALYTICAL CHEMISTRY),C,BACHELOR OF SCIENCE IN ANALYTICAL CHEMISTRY,BACHELOR OF SCIENCE IN ANALYTICAL CHEMISTRY WITH COMPUTING,BACHELOR OF SCIENCE (ANALYTICAL CHEMISTRY),BACHELOR OF SCIENCE IN ANALYTICAL CHEMISTRY
C+,MAT A,PHY,CHE,BIO,C+,"BACHELOR OF TECHNOLOGY IN WATER, IRRIGATION AND ENVIRONMENTAL ENGINEERING",C+,C+,"BACHELOR OF TECHNOLOGY IN WATER, IRRIGATION AND ENVIRONMENTAL ENGINEERING"
C+,MAT A,PHY,CHE,BIO,C+,BACHELOR OF SCIENCE (PETROLEUM CHEMISTRY),C+,BACHELOR OF SCIENCE IN PETROLEUM EXPLORATION AND PRODUCTION,C+,BACHELOR OF SCIENCE IN PETROLEUM EXPLORATION AND PRODUCTION
C+,C+,MAT A,PHY,CHE,BIO,C+,C+,C+,BACHELOR OF SCIENCE (AGRICULTURAL ENGINEERING),BACHELOR OF SCIENCE (AGRICULTURAL ENGINEERING)
C+,MAT A,PHY,CHE,BIO,BACHELOR OF SCIENCE IN ANALYTICAL CHEMISTRY,BACHELOR OF SCIENCE (ANALYTICAL CHEMISTRY),BACHELOR OF SCIENCE IN ANALYTICAL CHEMISTRY,C,BACHELOR OF SCIENCE (ANALYTICAL CHEMISTRY),C,BACHELOR OF SCIENCE IN ANALYTICAL CHEMISTRY,BACHELOR OF SCIENCE IN ANALYTICAL CHEMISTRY WITH COMPUTING,BACHELOR OF SCIENCE (ANALYTICAL CHEMISTRY),BACHELOR OF SCIENCE IN ANALYTICAL CHEMISTRY WITH COMPUTING
C+,MAT A,PHY,CHE,BIO,C+,BACHELOR OF SCIENCE IN COMPUTER SYSTEMS ENGINEERING,C+,C+,BACHELOR OF SCIENCE IN COMPUTER SYSTEMS ENGINEERING
C+,BACHELOR OF SCIENCE (MINING PHYSICS),MAT A,PHY,CHE,BIO,C+,C+,C+,BACHELOR OF SCIENCE (MINING AND MINERAL PROCESSING ENGINEERING),BACHELOR OF SCIENCE (MINING PHYSICS),BACHELOR OF SCIENCE (MINING AND MINERAL PROCESSING ENGINEERING)
C+,MAT A,PHY,CHE,BIO,C,C,BACHELOR OF TECHNOLOGY IN APPLIED CHEMISTRY,BACHELOR OF TECHNOLOGY IN APPLIED CHEMISTRY
C,MAT A,PHY,CHE,BIO,BACHELOR OF EDUCATION TECHNOLOGY (COMPUTER STUDIES),C,C,BACHELOR OF EDUCATION TECHNOLOGY (COMPUTER STUDIES)
C+,BACHELOR OF SCIENCE (MINING PHYSICS),MAT A,PHY,CHE,BIO,C+,C+,C+,BACHELOR OF SCIENCE (MINING AND MINERAL PROCESSING ENGINEERING),BACHELOR OF SCIENCE (MINING PHYSICS),BACHELOR OF SCIENCE (MINING PHYSICS)
C,MAT A,PHY,CHE,BIO,C,BACHELOR OF EDUCATION (TECHNOLOGY EDUCATION),C,BACHELOR OF EDUCATION (TECHNOLOGY EDUCATION),BACHELOR OF EDUCATION (TECHNOLOGY EDUCATION)
C,MAT A,PHY,CHE,BIO,BACHELOR OF SCIENCE (RENEWABLE ENERGY AND BIOFUELS TECHNOLOGY),BACHELOR OF TECHNOLOGY IN RENEWABLE ENERGY,BACHELOR OF SCIENCE (RENEWABLE ENERGY),BACHELOR OF SCIENCE (RENEWABLE ENERGY AND TECHNOLOGY),C,C,BACHELOR OF TECHNOLOGY IN RENEWABLE ENERGY & ENVIRONMENTAL PHYSICS,BACHELOR OF SCIENCE IN RENEWABLE ENERGY TECHNOLOGY,BACHELOR OF SCIENCE (RENEWABLE ENERGY)
C,MAT A,PHY,CHE,BIO,C,C,BACHELOR OF SCIENCE (ELECTRONICS),BACHELOR OF SCIENCE (ELECTRONICS)
C,MAT A,PHY,CHE,BIO,C,BACHELOR OF SCIENCE IN APPLIED OPTICS AND LASERS,C,BACHELOR OF SCIENCE IN APPLIED OPTICS AND LASERS
C,MAT A,PHY,CHE,BIO,BACHELOR OF SCIENCE (RENEWABLE ENERGY AND BIOFUELS TECHNOLOGY),BACHELOR OF TECHNOLOGY IN RENEWABLE ENERGY,BACHELOR OF SCIENCE (RENEWABLE ENERGY),BACHELOR OF SCIENCE (RENEWABLE ENERGY AND TECHNOLOGY),C,C,BACHELOR OF TECHNOLOGY IN RENEWABLE ENERGY & ENVIRONMENTAL PHYSICS,BACHELOR OF SCIENCE IN RENEWABLE ENERGY TECHNOLOGY,BACHELOR OF SCIENCE (RENEWABLE ENERGY AND BIOFUELS TECHNOLOGY)
C+,MAT A,PHY,CHE,BIO,C+,C+,BACHELOR OF ENGINEERING (INDUSTRIAL AND TEXTILE ENGINEERING),C+,BACHELOR OF ENGINEERING (INDUSTRIAL AND TEXTILE ENGINEERING)
C,MAT A,PHY,CHE,BIO,BACHELOR OF SCIENCE (RENEWABLE ENERGY AND BIOFUELS TECHNOLOGY),BACHELOR OF TECHNOLOGY IN RENEWABLE ENERGY,BACHELOR OF SCIENCE (RENEWABLE ENERGY),BACHELOR OF SCIENCE (RENEWABLE ENERGY AND TECHNOLOGY),C,C,BACHELOR OF TECHNOLOGY IN RENEWABLE ENERGY & ENVIRONMENTAL PHYSICS,BACHELOR OF SCIENCE IN RENEWABLE ENERGY TECHNOLOGY,BACHELOR OF TECHNOLOGY IN RENEWABLE ENERGY
C+,MAT A,PHY,CHE,BIO,BACHELOR OF SCIENCE (PETROLEUM CHEMISTRY),C,BACHELOR OF SCIENCE IN PETROLEUM EXPLORATION AND PRODUCTION,C,BACHELOR OF SCIENCE (PETROLEUM CHEMISTRY)
C,MAT A,PHY,CHE,BIO,BACHELOR OF SCIENCE (RENEWABLE ENERGY AND BIOFUELS TECHNOLOGY),BACHELOR OF TECHNOLOGY IN RENEWABLE ENERGY,BACHELOR OF SCIENCE (RENEWABLE ENERGY),BACHELOR OF SCIENCE (RENEWABLE ENERGY AND TECHNOLOGY),C,C,BACHELOR OF TECHNOLOGY IN RENEWABLE ENERGY & ENVIRONMENTAL PHYSICS,BACHELOR OF SCIENCE IN RENEWABLE ENERGY TECHNOLOGY,BACHELOR OF TECHNOLOGY IN RENEWABLE ENERGY & ENVIRONMENTAL PHYSICS
C+,MAT A,PHY,CHE,BIO,C+,BACHELOR OF SCIENCE (RENEWABLE ENERGY TECHNOLOGY AND MANAGEMENT),C+,C+,BACHELOR OF SCIENCE (RENEWABLE ENERGY TECHNOLOGY AND MANAGEMENT)
C+,MAT A,PHY,CHE,BIO,C+,BACHELOR OF TECHNOLOGY (CHEMICAL ENGINEERING),C+,C+,BACHELOR OF TECHNOLOGY (CHEMICAL ENGINEERING)
C,MAT A,PHY,CHE,BIO,BACHELOR OF SCIENCE (RENEWABLE ENERGY AND BIOFUELS TECHNOLOGY),BACHELOR OF TECHNOLOGY IN RENEWABLE ENERGY,BACHELOR OF SCIENCE (RENEWABLE ENERGY),BACHELOR OF SCIENCE (RENEWABLE ENERGY AND TECHNOLOGY),C,C,BACHELOR OF TECHNOLOGY IN RENEWABLE ENERGY & ENVIRONMENTAL PHYSICS,BACHELOR OF SCIENCE IN RENEWABLE ENERGY TECHNOLOGY,BACHELOR OF SCIENCE IN RENEWABLE ENERGY TECHNOLOGY
C,MAT A,PHY,CHE,BIO,BACHELOR OF SCIENCE IN TELECOMMUNICATION,BACHELOR OF SCIENCE IN TELECOMMUNICATION,C,C,BACHELOR OF SCIENCE IN TELECOMMUNICATION
C,MAT A,PHY,CHE,BIO,BACHELOR OF SCIENCE (DISASTER MITIGATION AND SUSTAINABLE DEVELOPMENT),C+,C+,BACHELOR OF SCIENCE (DISASTER PREPAREDNESS AND ENVIRONMENT TECHNOLOGY)
C,MAT A,PHY,CHE,BIO,BACHELOR OF SCIENCE (RENEWABLE ENERGY AND BIOFUELS TECHNOLOGY),BACHELOR OF TECHNOLOGY IN RENEWABLE ENERGY,BACHELOR OF SCIENCE (RENEWABLE ENERGY),BACHELOR OF SCIENCE (RENEWABLE ENERGY AND TECHNOLOGY),C,C,BACHELOR OF TECHNOLOGY IN RENEWABLE ENERGY & ENVIRONMENTAL PHYSICS,BACHELOR OF SCIENCE IN RENEWABLE ENERGY TECHNOLOGY,BACHELOR OF SCIENCE (RENEWABLE ENERGY AND TECHNOLOGY)
C,MAT A,PHY,CHE,BIO,BACHELOR OF TECHNOLOGY IN MECHANICAL VENTILATION AND AIR CONDITIONING,C,C,BACHELOR OF TECHNOLOGY IN MECHANICAL VENTILATION AND AIR CONDITIONING
C,MAT A,PHY,CHE,BIO,BACHELOR OF TECHNOLOGY (TELECOMMUNICATION AND INFORMATION ENGINEERING),C,C,BACHELOR OF TECHNOLOGY (TELECOMMUNICATION AND INFORMATION ENGINEERING)
C,MAT A,PHY,CHE,BIO,BACHELOR OF INDUSTRIAL TECHNOLOGY,C,C,BACHELOR OF INDUSTRIAL TECHNOLOGY
C+,BACHELOR OF AGRIBUSINESS MANAGEMENT,BACHELOR OF SCIENCE (AGRIBUSINESS MANAGEMENT),MAT A,BIO,PHY,PHY,BACHELOR OF AGRIBUSINESS MANAGEMENT,BACHELOR OF SCIENCE(AGRIBUSINESS MANAGEMENT),BACHELOR OF SCIENCE IN AGRIBUSINESS ECONOMICS AND FOOD INDUSTRY MANAGEMENT,BACHELOR OF SCIENCE IN AGRIBUSINESS MANGEMENT,BACHELOR OF SCIENCE IN AGRIBUSINESS MANAGEMENT,BACHELOR OF AGRIBUSINESS MANAGEMENT,BACHELOR OF AGRIBUSINESS MANAGEMENT,BACHELOR OF SCIENCE IN AGRIBUSINESS MANAGEMENT AND TRADE,"BACHELOR OF SCIENCE (AGRIBUSINESS MANAGEMENT, WITH IT)",BACHELOR OF SCIENCE IN AGRIBUSINESS MANAGEMENT AND MARKETING,C+,BACHELOR OF SCIENCE AGRIBUSINESS MANAGEMENT,BACHELOR OF SCIENCE (AGRI BUSINESS MANAGEMENT),BACHELOR OF SCIENCE IN AGRIBUSINESS MANAGEMENT AND ENTREPRENEURSHIP,BACHELOR OF SCIENCE (AGRIBUSINESS MANAGEMENT & TRADE),BACHELOR OF SCIENCE (AGRIBUSINESS),BACHELOR OF SCIENCE IN AGRIBUSINESS MANAGEMENT AND ENTREPRENEURSHIP,BACHELOR OF SCIENCE IN AGRIBUSINESS MANAGEMENT,BACHELOR OF AGRIBUSINESS MANAGEMENT,"BACHELOR OF SCIENCE (AGRIBUSINESS MANAGEMENT, WITH IT)",BACHELOR OF SCIENCE (AGRIBUSINESS),BACHELOR OF SCIENCE (AGRIBUSINESS MANAGEMENT),BACHELOR OF SCIENCE (AGRIBUSINESS MANAGEMENT),BACHELOR OF SCIENCE (AGRIBUSINESS MANAGEMENT & TRADE)
C+,BACHELOR OF AGRIBUSINESS MANAGEMENT,BACHELOR OF SCIENCE (AGRIBUSINESS MANAGEMENT),MAT A,BIO,PHY,PHY,BACHELOR OF AGRIBUSINESS MANAGEMENT,BACHELOR OF SCIENCE(AGRIBUSINESS MANAGEMENT),BACHELOR OF SCIENCE IN AGRIBUSINESS ECONOMICS AND FOOD INDUSTRY MANAGEMENT,BACHELOR OF SCIENCE IN AGRIBUSINESS MANGEMENT,BACHELOR OF SCIENCE IN AGRIBUSINESS MANAGEMENT,BACHELOR OF AGRIBUSINESS MANAGEMENT,BACHELOR OF AGRIBUSINESS MANAGEMENT,BACHELOR OF SCIENCE IN AGRIBUSINESS MANAGEMENT AND TRADE,"BACHELOR OF SCIENCE (AGRIBUSINESS MANAGEMENT, WITH IT)",BACHELOR OF SCIENCE IN AGRIBUSINESS MANAGEMENT AND MARKETING,C+,BACHELOR OF SCIENCE AGRIBUSINESS MANAGEMENT,BACHELOR OF SCIENCE (AGRI BUSINESS MANAGEMENT),BACHELOR OF SCIENCE IN AGRIBUSINESS MANAGEMENT AND ENTREPRENEURSHIP,BACHELOR OF SCIENCE (AGRIBUSINESS MANAGEMENT & TRADE),BACHELOR OF SCIENCE (AGRIBUSINESS),BACHELOR OF SCIENCE IN AGRIBUSINESS MANAGEMENT AND ENTREPRENEURSHIP,BACHELOR OF SCIENCE IN AGRIBUSINESS MANAGEMENT,BACHELOR OF AGRIBUSINESS MANAGEMENT,"BACHELOR OF SCIENCE (AGRIBUSINESS MANAGEMENT, WITH IT)",BACHELOR OF SCIENCE (AGRIBUSINESS),BACHELOR OF SCIENCE (AGRIBUSINESS MANAGEMENT),BACHELOR OF SCIENCE (AGRIBUSINESS MANAGEMENT),BACHELOR OF SCIENCE (AGRIBUSINESS MANAGEMENT)
C+,BACHELOR OF AGRIBUSINESS MANAGEMENT,BACHELOR OF SCIENCE (AGRIBUSINESS MANAGEMENT),MAT A,BIO,PHY,PHY,BACHELOR OF AGRIBUSINESS MANAGEMENT,BACHELOR OF SCIENCE(AGRIBUSINESS MANAGEMENT),BACHELOR OF SCIENCE IN AGRIBUSINESS ECONOMICS AND FOOD INDUSTRY MANAGEMENT,BACHELOR OF SCIENCE IN AGRIBUSINESS MANGEMENT,BACHELOR OF SCIENCE IN AGRIBUSINESS MANAGEMENT,BACHELOR OF AGRIBUSINESS MANAGEMENT,BACHELOR OF AGRIBUSINESS MANAGEMENT,BACHELOR OF SCIENCE IN AGRIBUSINESS MANAGEMENT AND TRADE,"BACHELOR OF SCIENCE (AGRIBUSINESS MANAGEMENT, WITH IT)",BACHELOR OF SCIENCE IN AGRIBUSINESS MANAGEMENT AND MARKETING,C+,BACHELOR OF SCIENCE AGRIBUSINESS MANAGEMENT,BACHELOR OF SCIENCE (AGRI BUSINESS MANAGEMENT),BACHELOR OF SCIENCE IN AGRIBUSINESS MANAGEMENT AND ENTREPRENEURSHIP,BACHELOR OF SCIENCE (AGRIBUSINESS MANAGEMENT & TRADE),BACHELOR OF SCIENCE (AGRIBUSINESS),BACHELOR OF SCIENCE IN AGRIBUSINESS MANAGEMENT AND ENTREPRENEURSHIP,BACHELOR OF SCIENCE IN AGRIBUSINESS MANAGEMENT,BACHELOR OF AGRIBUSINESS MANAGEMENT,"BACHELOR OF SCIENCE (AGRIBUSINESS MANAGEMENT, WITH IT)",BACHELOR OF SCIENCE (AGRIBUSINESS),BACHELOR OF SCIENCE (AGRIBUSINESS MANAGEMENT),BACHELOR OF SCIENCE (AGRIBUSINESS MANAGEMENT),BACHELOR OF SCIENCE (AGRI BUSINESS MANAGEMENT)
C+,BACHELOR OF AGRIBUSINESS MANAGEMENT,BACHELOR OF SCIENCE (AGRIBUSINESS MANAGEMENT),MAT A,BIO,PHY,PHY,BACHELOR OF AGRIBUSINESS MANAGEMENT,BACHELOR OF SCIENCE(AGRIBUSINESS MANAGEMENT),BACHELOR OF SCIENCE IN AGRIBUSINESS ECONOMICS AND FOOD INDUSTRY MANAGEMENT,BACHELOR OF SCIENCE IN AGRIBUSINESS MANGEMENT,BACHELOR OF SCIENCE IN AGRIBUSINESS MANAGEMENT,BACHELOR OF AGRIBUSINESS MANAGEMENT,BACHELOR OF AGRIBUSINESS MANAGEMENT,BACHELOR OF SCIENCE IN AGRIBUSINESS MANAGEMENT AND TRADE,"BACHELOR OF SCIENCE (AGRIBUSINESS MANAGEMENT, WITH IT)",BACHELOR OF SCIENCE IN AGRIBUSINESS MANAGEMENT AND MARKETING,C+,BACHELOR OF SCIENCE AGRIBUSINESS MANAGEMENT,BACHELOR OF SCIENCE (AGRI BUSINESS MANAGEMENT),BACHELOR OF SCIENCE IN AGRIBUSINESS MANAGEMENT AND ENTREPRENEURSHIP,BACHELOR OF SCIENCE (AGRIBUSINESS MANAGEMENT & TRADE),BACHELOR OF SCIENCE (AGRIBUSINESS),BACHELOR OF SCIENCE IN AGRIBUSINESS MANAGEMENT AND ENTREPRENEURSHIP,BACHELOR OF SCIENCE IN AGRIBUSINESS MANAGEMENT,BACHELOR OF AGRIBUSINESS MANAGEMENT,"BACHELOR OF SCIENCE (AGRIBUSINESS MANAGEMENT, WITH IT)",BACHELOR OF SCIENCE (AGRIBUSINESS),BACHELOR OF SCIENCE (AGRIBUSINESS MANAGEMENT),BACHELOR OF SCIENCE (AGRIBUSINESS MANAGEMENT),BACHELOR OF SCIENCE(AGRIBUSINESS MANAGEMENT)
C+,BACHELOR OF AGRIBUSINESS MANAGEMENT,BACHELOR OF SCIENCE (AGRIBUSINESS MANAGEMENT),MAT A,BIO,PHY,PHY,BACHELOR OF AGRIBUSINESS MANAGEMENT,BACHELOR OF SCIENCE(AGRIBUSINESS MANAGEMENT),BACHELOR OF SCIENCE IN AGRIBUSINESS ECONOMICS AND FOOD INDUSTRY MANAGEMENT,BACHELOR OF SCIENCE IN AGRIBUSINESS MANGEMENT,BACHELOR OF SCIENCE IN AGRIBUSINESS MANAGEMENT,BACHELOR OF AGRIBUSINESS MANAGEMENT,BACHELOR OF AGRIBUSINESS MANAGEMENT,BACHELOR OF SCIENCE IN AGRIBUSINESS MANAGEMENT AND TRADE,"BACHELOR OF SCIENCE (AGRIBUSINESS MANAGEMENT, WITH IT)",BACHELOR OF SCIENCE IN AGRIBUSINESS MANAGEMENT AND MARKETING,C+,BACHELOR OF SCIENCE AGRIBUSINESS MANAGEMENT,BACHELOR OF SCIENCE (AGRI BUSINESS MANAGEMENT),BACHELOR OF SCIENCE IN AGRIBUSINESS MANAGEMENT AND ENTREPRENEURSHIP,BACHELOR OF SCIENCE (AGRIBUSINESS MANAGEMENT & TRADE),BACHELOR OF SCIENCE (AGRIBUSINESS),BACHELOR OF SCIENCE IN AGRIBUSINESS MANAGEMENT AND ENTREPRENEURSHIP,BACHELOR OF SCIENCE IN AGRIBUSINESS MANAGEMENT,BACHELOR OF AGRIBUSINESS MANAGEMENT,"BACHELOR OF SCIENCE (AGRIBUSINESS MANAGEMENT, WITH IT)",BACHELOR OF SCIENCE (AGRIBUSINESS),BACHELOR OF SCIENCE (AGRIBUSINESS MANAGEMENT),BACHELOR OF SCIENCE (AGRIBUSINESS MANAGEMENT),BACHELOR OF SCIENCE IN AGRIBUSINESS MANGEMENT
C+,BACHELOR OF AGRIBUSINESS MANAGEMENT,BACHELOR OF SCIENCE (AGRIBUSINESS MANAGEMENT),MAT A,BIO,PHY,PHY,BACHELOR OF AGRIBUSINESS MANAGEMENT,BACHELOR OF SCIENCE(AGRIBUSINESS MANAGEMENT),BACHELOR OF SCIENCE IN AGRIBUSINESS ECONOMICS AND FOOD INDUSTRY MANAGEMENT,BACHELOR OF SCIENCE IN AGRIBUSINESS MANGEMENT,BACHELOR OF SCIENCE IN AGRIBUSINESS MANAGEMENT,BACHELOR OF AGRIBUSINESS MANAGEMENT,BACHELOR OF AGRIBUSINESS MANAGEMENT,BACHELOR OF SCIENCE IN AGRIBUSINESS MANAGEMENT AND TRADE,"BACHELOR OF SCIENCE (AGRIBUSINESS MANAGEMENT, WITH IT)",BACHELOR OF SCIENCE IN AGRIBUSINESS MANAGEMENT AND MARKETING,C+,BACHELOR OF SCIENCE AGRIBUSINESS MANAGEMENT,BACHELOR OF SCIENCE (AGRI BUSINESS MANAGEMENT),BACHELOR OF SCIENCE IN AGRIBUSINESS MANAGEMENT AND ENTREPRENEURSHIP,BACHELOR OF SCIENCE (AGRIBUSINESS MANAGEMENT & TRADE),BACHELOR OF SCIENCE (AGRIBUSINESS),BACHELOR OF SCIENCE IN AGRIBUSINESS MANAGEMENT AND ENTREPRENEURSHIP,BACHELOR OF SCIENCE IN AGRIBUSINESS MANAGEMENT,BACHELOR OF AGRIBUSINESS MANAGEMENT,"BACHELOR OF SCIENCE (AGRIBUSINESS MANAGEMENT, WITH IT)",BACHELOR OF SCIENCE (AGRIBUSINESS),BACHELOR OF SCIENCE (AGRIBUSINESS MANAGEMENT),BACHELOR OF SCIENCE (AGRIBUSINESS MANAGEMENT),"BACHELOR OF SCIENCE (AGRIBUSINESS MANAGEMENT, WITH IT)"
C+,BACHELOR OF SCIENCE (AGRICULTURAL ECONOMICS & RESOURCE MANAGEMENT),BACHELOR OF SCIENCE (AGRICULTURAL ECONOMICS),MAT A,BIO,PHY,PHY,BACHELOR OF SCIENCE (AGRICULTURAL ECONOMICS),BACHELOR OF SCIENCE (AGRICULTURAL ECONOMICS AND RURAL DEVELOPMENT),BACHELOR OF SCIENCE (AGRICULTURAL ECONOMICS AND RESOURCE MANAGEMENT),BACHELOR OF SCIENCE IN AGRICULTURE ECONOMICS & RESOURCE MANAGEMENT,BACHELOR OF SCIENCE (AGRICULTURAL RESOURCE MANAGEMENT),BACHELOR OF SCIENCE ( AGRICULTURAL ECONOMICS AND RESOURCE MANAGEMENT),BACHELOR OF SCIENCE IN AGRICULTURAL ECONOMICS,BACHELOR OF SCIENCE (AGRICULTURAL ECONOMICS,BACHELOR OF SCIENCE (AGRICULTURAL ECONOMICS & RESOURCE MANAGEMENT),"BACHELOR OF SCIENCE ( AGRICULTURAL ECONOMICS, WITH IT)",BACHELOR OF SCIENCE (AGRICULTURE ECONOMICS & RESOURCE MANAGEMENT),C+,BACHELOR OF SCIENCE (AGRICULTURAL ECONOMICS AND RESOURCE MANAGEMENT),BACHELOR OF SCIENCE (AGRICULTURAL ECONOMICS & RESOURCE MANAGEMENT),"BACHELOR OF SCIENCE ( AGRICULTURAL ECONOMICS, WITH IT)",BACHELOR OF SCIENCE ( AGRICULTURAL ECONOMICS AND RESOURCE MANAGEMENT),BACHELOR OF SCIENCE (AGRICULTURAL ECONOMICS AND RESOURCE MANAGEMENT),BACHELOR OF SCIENCE (AGRICULTURAL ECONOMICS & RESOURCE MANAGEMENT)
